,ID,发表时间,满意度,评论
165,16198520654,2021-08-26 15:10:03,5,第一次买笔记本，说真的，时尚全铝的机身真的惊艳了我，真的很漂亮，使用过程中屏幕和性能都非常满意，很滑溜！其它的功能有待探索，期待坚固耐用！强烈推荐！
166,16283535939,2021-09-10 22:14:44,5,感觉很不错，外观好看，全金属很有质感，这个屏幕特别棒??，3.2k看上去就是清晰，今天刚到货，具体使用感受还要看后续表现，目前感觉棒棒哒！
167,16311760546,2021-09-16 10:48:59,5,"最喜欢屏幕，同价位屏幕分辨率最好，物美价廉，希望耐用性够好。
大件电子产品，一如既往选京东，没有失望。"
168,16243415678,2021-09-03 11:07:09,5,"很棒的点电脑，质量很好，性能也很好。很喜欢。用一段时间后再追评。
运行速度：快
散热性能：好"
169,16291076212,2021-09-12 09:12:11,5,非常不错?，系统激活后巳帮助分区，开机关机及运行速度相当快，外形轻巧美观是非常愉快的购物
170,16540272548,2021-10-30 09:41:11,5,外观特好看，手感很好，充电器是小巧的c口充电器，支持100w充电
171,16253375622,2021-09-05 09:03:05,5,颜值很在线，性能也够用，搞java开发够够的，屏幕看着也很虚浮，键盘敲起来也很舒服，厚度也不厚，重量也比之前买的游戏本清了很多，爱了
172,16498668305,2021-10-22 05:56:32,5,"运行速度：速度非常快，办公够用了
屏幕效果：屏幕挺清晰的
散热性能：散热也能接受
外形外观：外观很简约大方
轻薄程度：很轻薄便利"
173,16219099451,2021-08-29 18:11:48,5,第一次买小米的电脑以前都是买手机 这次买一次电脑 京东物流很快 今天收到后 就按照操作激活了 很好 很喜欢 我就买来 上学用 没买配置太好的 这款够用了 客服也非常耐心 给我耐心解答激活的一些问题 好评
174,15763854131,2021-06-05 12:12:38,5,"运行速度：质量非常好，运行速度很快
屏幕效果：e4屏幕很客观，15.6大屏幕，打游戏看游戏都不错
散热性能：双风扇散热，效果很好
外形外观：一体成型设计，磨砂的手感特别好，金属机身，外观好看，轻薄"
175,16337053839,2021-09-20 23:21:09,5,"快递方面真心不错，由于福建疫情，本来快递就很难，但是还是两天左右就到货。快递小哥打了两次电话分别叮嘱，很负责任。
其次，小米电脑是真的不错，我通常用来办公，有时候打打饥荒等小游戏，今天到手所有软件下载CAD，游戏等等，内存够用，整体非常流畅，电脑并没有发烫。
最后就是小米的电脑设计，虽然看起来方方正正，但是细节处理的很不错！棱角没有那么突兀，看起来很舒服。今天收到，试运行很不错！之后若有什么不好的，我会追评，整体比较推荐！电脑关机了，不想打开了，凑合看吧"
176,16549855265,2021-11-01 01:20:38,5,整体上，机身品质感得到大大提升，高级感也油然而生，这一代小米笔记本 Pro从外观层面率先拿下一分。除了外观的提升，小米笔记本 Pro 15 OLED带来了该价格段目前最好的屏幕，这里确实可以违反广告法说&ldquo最好&rdquo，因为细数过往所有该价格段的产品都没如此数值碾压的屏。
177,16365300803,2021-09-26 15:05:40,5,笔记本做工精细，人机功效好！国货精品！性价比很高。手机也是红米，米家全家桶！
178,16281691291,2021-09-10 15:41:30,5,手机拍可能看不出来，但这个3.2k屏幕真的超清晰......我故意隔超近看 都完全看不到屏幕上的像素点，做工也非常精致！
179,16626172282,2021-11-12 11:39:19,5,双十一活动买的，性价比很高，运行速度很快，暂时很满意。
180,16206230192,2021-08-27 12:44:18,5,种草这款小米笔记本很久了，今天终于到手了，质感没的说，很棒，这个价位，这种做工和这款屏幕就是王者一样的存在，当然一分钱一分货，这款不是游戏本，适合办公！
181,16360519000,2021-09-25 18:11:12,5,外形外观：很大气上档次而又不失优雅，原神运行起来很卡，也不知道为什么，画质最低
182,15590462791,2021-04-22 20:59:10,5,一个可以很稳定很高颜值的笔记本，cpu性能强劲，做PS和视频剪辑都十分够用，屏幕够大重量也够便携，调整到175%缩放，字体和显示区域都强大，该有的都有，没有什么不满意的
183,16282813904,2021-09-10 20:02:42,5,选了很多，最终选了这款电脑！物流很快，第二天就到了。老公整理完了，说体验感很好?��?，样子好看，速度也快。好不好用再看后续吧！
184,15502418266,2021-04-05 19:28:02,5,京东物流很快，4号中午就送到了，包装的也很贴心。外观小米logo，很自信，还附赠了转接坞，可惜接口有些少。首发赠送小米鼠标，买到就是赚到。还没有开机，送孩子，倍儿有面！光外观就爱了爱了！！！
185,16219945058,2021-08-29 21:50:51,5,"屏幕效果：真的是很nice！格外清晰，性价比非常高了
外形外观：感谢某果～外观很能打   显得非常有精英气息
散热性能：散热还可以吧～性能办公无压力，一些比较小的Steam游戏也可以玩"
186,16273132451,2021-09-08 22:35:35,5,电脑质量很好，给侄儿学习用，挺薄的，各种接口也有，好评。手机和一些家用电器一直用小米，质量好，性价比高，一家人都用小米的东西。已经是米粉了，下次继续支持。
187,15521120074,2021-04-10 21:39:22,5,"电脑各方面都很不错
我是一名Python开发工程师，就是你们常说的程序员。
这款全新小米笔记本PRO 15寸很适合办公， 主流的网络游戏也能满足其性能要求。 办公游戏两不误。"
188,16375422282,2021-09-28 09:12:00,5,物流速度非常的快，一如既往。大小刚刚好，颜色也是刚刚好，然后内存性能都是不错的。用起来也比较轻便舒适。下次有活动的话，还会考虑入。
189,16511252467,2021-10-24 14:15:16,5,"运行速度：CPU很强悍，完全够用
屏幕效果：屏幕4k分辨率也很惊艳
散热性能：散热还好完全压得住
外形外观：外观简约，非常耐看
其他特色：京东快递物流非常快，不到24小时就送到手上了，而且非常信任京东平台"
190,16258381395,2021-09-06 10:51:55,5,"运行速度：开机或者下载软件都很快
屏幕效果：图片清晰，视网屏幕效果好
外形外观：简洁，漂亮，符合小米的颜值"
191,16246112085,2021-09-03 20:31:44,5,即使�{成省��模式（才能�慰焓�小�r），���X速度一�雍芸欤ㄎ赐孢[�蛳拢�。外�^也非常高��，屏幕也非常高清��面非常美好，推�]���I！
192,16239650204,2021-09-02 14:53:59,5,笔记本用着很舒服，做工精细，性能也很好，有个问题想问一下，充电时候充电器很烫正常不正常。
193,15526731209,2021-04-11 14:34:47,5,这次的小米笔记本做工非常好，外观也好看，用起来也很舒服！ 之前用普通的笔记本，太沉了，一直想要一个不错的轻薄本，小米这个笔记本完全满足我的需求，这个出差带着很爽，??????
194,16506590285,2021-10-23 16:12:00,5,非常不错，我很满意。第一次用小米的笔记本电脑，本来以为和专门做电脑的品牌差别很大，但是我还是想买小米。做了很多功课之后，下单了红米的笔记本电脑。用了一段时间了，感觉很好用。不玩游戏也不做视频剪辑，平时用来做做文档什么的感觉很适合。够用了。
195,16250770682,2021-09-04 17:41:43,5,快递速度很快，第二天上午就到了。看了很多款式，最终选择了红米这款，因为性价比超高，同价格的几款电脑都没有这么高的配置和这么好的屏幕，目前正常使用，没啥问题，开机很快，office正版的挺好用，希望以后也不出问题
196,16253504803,2021-09-05 09:36:40,5,"电脑很不错，打游戏也不卡，性能基本够用。
外观的话也很商务，非常好看，手感也是没得说。
价格方面也算比较实惠了，所以总体来说这台电脑性价比还是比较高的。值得入手。"
197,16195028872,2021-08-25 23:31:58,5,"屏幕看起来非常舒服，操作简单，跟着语音走就行了，使用起来很流畅，配置挺强大的。
给京东物流点赞，上午下单的，下午就到了，优秀！"
198,15875580812,2021-06-27 00:29:58,5,"小米和redmi的各有优势,最后还是决定选择了小米这款笔记本电脑,打开屏幕瞬间，当初的决定是正确的，这款电脑
的性价比很高，关键是显示屏OLED。redmi的优势是接口多，小米的屏幕太惊艳了，配置都给力。京东商城配送速度也是很给力的，第二天就到了，推荐给大家购买。"
199,16363921597,2021-09-26 11:28:54,5,电子产品都在京东上选就对了，质量有保证，售后服务也很到位，到货速度也快。笔记本外观简洁大方，用起来也挺顺手，买得挺称心。
