,ID,发表时间,满意度,评论
138,15623138632,2021-05-01 19:01:35,5,五一凌晨抢的首发，到货八角尖尖，开机激活顺利，屏幕很清晰，音响声音清晰洪亮，打开角度虽然没有180度但也能打开超过140度，也很好了，网卡是英特尔的，硬盘是西数的，很满足了，作为办公机浅度娱乐5500很好了，再高8核的也用不上，这个性价比值得推荐
139,15779447190,2021-06-08 15:55:12,5,笔记本外观金属材料，质感非常强，电脑轻薄，120hz.2k.16寸大屏幕非常赞，非常细腻，电脑运行快，日常办公无压力。超喜欢！
140,16458012152,2021-10-13 23:00:22,5,"屏幕素质确实很赞，2k分辨率，90hz刷新率，刷剧看文档都超级爽。键盘带背光，晚上也看得清。全金属机身，质感杠杠的，就是有点点重。音响也不错哈。
win11配锐龙，速度直接起飞，瞬间反馈的感觉哈。啥也不说了，amd Yes."
141,16432362059,2021-10-08 14:31:10,5,收到货之后打开包装，看到银色的整机，让人觉得赏心悦目，充电开机之后的屏幕让我眼前一亮，不愧是2.8K屏幕，非常清晰，开机速度快，目前运行也很快，windows 11系统用起来也很顺，感觉很好！
142,15637449552,2021-05-05 19:59:53,5,PRO16很舒服，ACD面金属材质，手感很棒，重量可以接受，2.5K屏幕很舒服，散热上面F10周围挺热的，但是能接受，下面的温度保持很不错，做工细节很到位，喜欢！下次还买联想！
143,15776163637,2021-06-07 21:51:42,5,东西很好很不错，第一次使用联想的电脑，我觉得还是超出我的预期的。感觉质量不错，刚拿到的时候打开来，发现屏幕还是很清晰的，2.2k屏幕确实不错，这一款感觉够用了5600H，加上显卡我觉得很多办公软件都很够用，平时开发软件用java、Python等都很ok。键盘键程效果回弹也很舒服。适合。
144,15635857819,2021-05-05 12:50:47,5,"屏幕效果：120hz 刷新率，看网页和pdf很顺滑，倍儿爽
外形外观：灰色大气，低调耐看，
其他特色：键盘手感好，感觉比r9000k还好，这个是主观体验
轻薄程度：轻薄满意，重量能接受
散热性能：静音，买来就是静音办公的。游戏本的话会很吵
运行速度：满意

首发当天就快递送到，换上1T硬盘，美滋滋啊⊙o⊙"
145,16423557626,2021-10-06 21:42:37,5,一句话，这个价位无敌，吊打友商。金属机身非常好，重量也挺合适，以后出门很方便了。
146,15480851009,2021-03-30 22:11:18,5,做了好几天攻略，最后决定入手小新，太难买了，预售抢了好久才抢到，果然，收到货物超所值，对于我来说这个本子就够了，高级轻薄触感佳，完全符合我的要求，女孩子拿也不会沉，大气简单款，nice！一百分！而且联想客服服务态度超好，引导我一步步完成了office激活，联想小新网联畅通，运行速度快，值得入手的好产品！
147,16442550282,2021-10-10 14:28:19,5,"超级轻薄！本来想买yoga14s的，刚好碰上高刷版小新pro14新发布，所以果断下单抢了一台，价格也很美丽！
运行速度：很快
屏幕效果：完美
散热性能：棒"
148,15628002154,2021-05-03 10:12:34,5,"第一次买的联想，很喜欢。首先拿到手的感觉就是很精致，包装很好看。然后就是整机很轻巧，非常便携。屏幕非常舒服。键盘挺舒服的。考虑了很久还是入手了小新air15,京东物流还是挺快的，性能强悍小新air15相比小新15是全金属机身，颜值不错，开机6秒左右，拥有指纹解锁功能，性价比超高全尺寸背光键盘，超级好看，接口丰富，小键盘设计特别喜欢，还有超大电池，是轻薄本，很喜欢。"
149,16434626108,2021-10-08 23:22:54,5,终于等到了！！颜值超高，单手翻盖不是梦！三秒内开机关机，镜面屏很赞?原本担心11系统用不惯，其实也不会，日常办公足矣啦！
150,15799014497,2021-06-12 21:48:42,5,"抢到了首发，好开心，京东的物流真的快，11号当天就到了，电脑非常满意，符合我的预期
外形外观：金属面板，手感超好，颜值爆表
轻薄程度：外观看起来很轻薄，上手略重一点点，但是并没有想象中的重，堆料很足的情况下能控制到这种程度已经很不错了
屏幕效果：屏幕非常清晰，显示效果非常棒，暗光下边缘有一点漏光，但是日常使用不受影响
运行速度：非常流畅，日常使用毫无压力，大部分游戏都能流畅运行
散热性能：两个风扇十分给力，玩游戏时温度控制的还行，只在靠近转轴的地方有些发热，键盘部位温度控制的很好
其他特色：人脸识别好评，用了就回不去了，全尺寸键盘和键盘背光灯好评"
151,16672035940,2021-11-17 15:12:11,3,还没测试机子，找个懂得测试了来评价
152,15633410037,2021-05-04 18:40:27,5,"屏幕：屏幕素质挺好，屏幕也很大，很适合看直播看剧写论文，美滋滋！
外观：外观挺简约，跟我前两年买的外观差不多，可能就是厚了一些，毕竟有大电池呢！
物流：物流真的很快，5.1下午买的，2好中午就到了。"
153,16349021130,2021-09-23 10:58:50,5,电脑反应挺快的，一般的公司办公完全Ok，简单的CAD也能做，自带一个垫高的也非常nice，自己在官网配了一个蓝牙鼠标也非常棒，轻薄方便携带，推荐！
154,15841020476,2021-06-20 19:13:58,5,使用了几天才来评价，金属机身手感太棒了，联盟满帧运行，吃鸡也是无压力，表格什么的，屏幕显示真细腻，人脸解锁有点东西，在这个价位里妥妥的水桶机。想买16的机子的时候，看到快出30了，就等了等3050的机子首发买到，真是赚到了，喜欢的，关注好时间抢一台吧。
155,15978350063,2021-07-13 14:37:02,5,很好的电脑，目前没有卡顿，外观很漂亮，15寸的电脑也没有觉得很重，单手可以拿起来。单手开合很好评，非常棒，自带的微软office激活也不难，一会就激活了，非常棒！
156,15628973191,2021-05-03 14:53:09,5,"外观材质：外观非常大气！屏幕很大，携带方便 
显卡效果：显卡效果相当不错4g显存，大部分游戏无压力 电脑性能：性能不用说，肯定是非常的好，512固态+16g内存+1650显卡，平时办公游戏都么问题"
157,16431700510,2021-10-08 11:51:31,5,"屏幕效果：屏幕效果：90Hz高刷的2.8k镜面屏非常给力

轻薄程度：比之前买的Pro13略重
外形外观：简约时尚，品控这块还是差点意思
散热性能：14寸的小机身里装俩风扇必须给力
运行速度：zen3的6和12线程，对于只用于办公的我显然绰绰有余

总体来说对机器非常满意，还是希望以后能把品控做好"
158,16057101767,2021-07-29 23:51:00,5,"新机到手~抢购确实不容易，
开箱激活系统和office之后，
高色域高刷+高分辨率屏幕，
这么好的屏幕当然~爱奇艺，
全尺寸键盘~但键位间距小，
还不错~很适合手小的女生，
固态读写速度不错~还很稳，
这台机子还蛮新~15号生产，
日常使用独显没跑过cup5%
各位加油冲叭?我追剧咯?"
159,16446406135,2021-10-11 12:14:01,5,"运行速度：得益于锐龙5600H的加持以及联想自己对于模具散热性能的高要求，运行使用十分流畅。
屏幕效果：90赫兹高刷新屏幕，400尼特的亮度，加上护眼，显示效果满分。
散热性能：双热管双风扇，非常给力，能够强力的散热。
外形外观：外形比较精致，做工也比之前好太多了。"
160,15760982510,2021-06-04 19:07:09,5,首发入手 颜色很好看 做工也很好 运行很顺畅 没有白点 至于漏光没有看出来 试了下剪辑视频和修图 很不错 毫无压力 总得来说目前挺满意的
161,16354126507,2021-09-24 13:07:09,5,联想小新，笔记本中的爱马仕，炒鸡高性价比，外观简单美观，配置杠杠高，买的带小数字键盘的，平时办公很方便，而且拿着也不会很沉，很轻便，灰色颜色很高端大气，用来商务办公很合适！
162,16428678693,2021-10-07 20:20:33,5,深灰色外观大气，金属外壳质感很好，包装精美，性价比高，联想小新pro16真的是一款好产品，想买电脑的真的可以考虑下。很轻薄！
163,15655026649,2021-05-10 12:21:45,5,"调研了好几个月的笔记本电脑?，终于等来了几年来的首款amd+mx独显的真香组合！
配置不用说，最新zen3架构cpu，30w性能释放??，性价比超intel?，配合ddr6的mx450独显，可胜任大部分办公及游戏需求。
轻薄方面，1.4kg，轻松放进书包?在14寸的电脑里算轻的了。
续航方面也很给力，轻度办公三四小时，只用了十几的电！
抢首发买的，太值了！"
164,15755286242,2021-06-03 16:44:26,5,"看了好几款，最后选了小新pro16！非常棒，6.1下单，下午就到了！！！
按照语音提示激活电脑，深空灰颜值高，电脑运行流畅，日常办公绝对没问题，还有小键盘，键盘背光，很方便，联想大品牌，售后有保障，强烈推荐购买
运行速度：非常流畅
屏幕效果：2.5k 120hz 雾面屏 完美
散热性能：散热小霸王
外形外观：高端大气上档次
轻薄程度：1.9kg"
165,16428031485,2021-10-07 18:36:48,5,做工超出想象，漂亮，很有质感。屏显质量很好，声效也很强。核心上5800u就更好了。快递差点送错地方，影响不大。
166,16434017611,2021-10-08 20:41:21,5,颜值很高，手感很好，也不重。屏幕真的很清晰，开机设置流程也很顺利，音效，键盘手感也挺好的，总之还算满意，希望耐用。还有，小姐姐人很好。
167,15647579221,2021-05-08 13:02:28,5,经过多方比较，选中了联想小新这款笔记本。2.2k屏幕很清晰，cpu够用，而且还是450独显，夜光键盘，接口齐全，很轻薄。要说不足，目前还真没看出来。联想自带的软件中心也很好，驱动都不用找，可以在线升级。机器发热也还好，可以跑魔兽世界，不卡顿。主要是做工还不错啦，感觉比其他品牌靠得住。用得好的话，估计七八年没问题。我感觉小新值得买。
168,16429356694,2021-10-07 22:06:52,5,"运行速度：5600h还不错
屏幕效果：2k的屏幕真的很细腻
散热性能：散热极差
外形外观：好康的一比
轻薄程度：很薄"
169,15628502860,2021-05-03 12:34:32,5,"第一次在京东上买大件东西，整机外观非常漂亮，色彩大气，开机很快。
运行速度：很快
屏幕效果：色彩流畅
轻薄程度：很薄，不重，清巧"
170,15995607960,2021-07-17 09:04:14,5,发货很快，包装挺严实的，打开包装的那一刻很激动，是我喜欢的，而且用起来手感特别棒，性能都跟的上，是**常办公娱乐，电脑画面清晰，运行速度快，不卡顿，很有质感不错
171,16436617352,2021-10-09 11:47:36,5,笔记本外观好看，颜色耐脏，金属机身有质感。屏幕效果优秀，性能释放给力，人脸识别方便实用，最重要是接口丰富。配套的充电器很轻便，笔记本的尺寸重量配置都很均衡。
172,16244177984,2021-09-03 13:25:40,5,总之非常丝滑就对了，16寸的不用担心大或者重（对男生而言），最后一一张对比我以前15.6寸的电脑，还要小一些，而且有数字小键盘，所以整体体验非常可
173,16279886683,2021-09-10 10:05:23,5,买电脑的时候真的好纠结好纠结，最后还是选了这一款联想小新Air15！颜色很好看，很高级，我挺喜欢的！屏幕也很清晰，音质也很好！我觉得挺好的！
174,15810061409,2021-06-15 14:59:39,5,"整体质量很好，外观好看，触感很好，键盘还有背光的功能。
颜值高，键盘布局超级喜欢，重量也只有两千克，锐龙性价比超高。
性能非常强劲，速度很快，联想这款电脑品控还不错，屏幕也棒，看的很舒服。"
175,15629290233,2021-05-03 16:23:29,5,"屏幕效果：屏幕效果很棒，画面细腻。
外形外观：外观简约大气，随手一放颜值就很高。
轻薄程度：虽然看起来很大，但是电脑很薄很轻，没有想象中的那么厚重。
运行速度：速度很快，性能不错。"
176,15753067051,2021-06-03 09:03:23,5,"啊nice，6.1号凌晨付的尾款，第二天下午到的。
入手就按照up的方法测试了一遍，完美。
16英寸大屏幕，2.5k超级清晰，感觉壁纸都那么美，作为学生党第一台电脑很不错。
漏光看不出，也没有白点，5600入手，确实香。
喂一缺点还是只有一个固态硬盘借口。"
177,15660793440,2021-05-11 19:27:47,5,"非常nice，京东物流超级快，两天就到了。
电脑也还不错2.2k屏幕，基本上没有颗粒感。
就是MX450的2G显存拉跨了许多。
非常棒的一次购物体验。"
178,15845613074,2021-06-21 15:09:25,5,性价比超高，总体来说特别满意！外观漂亮简约，满意。屏幕更加满意，窄边框，高刷屏！键位舒适。性能释放满意，野兽模式相当强劲！推荐购买！
179,15938422723,2021-07-07 09:49:45,5,这款笔记本是全金属机身，材质和做工都很到位，质感很不错。屏幕的屏占比，亮度，分辨率和刷新率表现良好。性能方面，这套硬件组合足以流畅运行目前的绝大部分3a级大游戏。虽然散热确实不如游戏本，而且重量偏高，但是一个轻薄本的体积能够做到这么多，已经没有挑刺的必要。简单总结，这是一款比较全能的笔记本，足够满足绝大部分人的日常娱乐办公需求。
180,15659487464,2021-05-11 14:02:23,5,联想的做笔记本真是出神入化，产品定位非常准确，填补市场空白，这个产品绝对是目前独一份，我找了很久很久终于等到这款标压锐龙R7 5800H带独立显卡的轻薄本。好不容易，费劲艰辛，抢到一份首发，非常满意！
181,15767019633,2021-06-05 23:55:13,5,满分好评，已经关注很久很久了。大屏高分辨率+小键盘+独显+支持PD充电，重量还算过得去，AMD yes，硬盘还是SN730，硬件满分，颜值也满分。鲁大师测过，屏幕无亮点，无坏点，已经用了好几天了，非常苏服～
182,15500725951,2021-04-05 11:35:05,5,看了很多电脑，还是决定在京东买联想小新。非常不错，适合出差用。续航能力强，开机时间快，目前使用中非常满意。
183,16503393094,2021-10-22 23:36:15,5,这款电脑真不错，外观看起来特别精致，银色也非常百搭，电脑运行速度流畅，屏幕挺大的，窄边框看着很舒服，散热效果也好，性价比很高，活动期间抢到一台，真的太划算了。
184,15623425821,2021-05-01 20:42:09,5,首先要说，京东物流是真的很快。然后说机子，做工很良心，轻薄本就是薄，运行速度很快，开机后还没听到风扇声音，面部解锁很快，小键盘对于需要敲数据的人来说算是福音，目前好评
185,15756577965,2021-06-03 20:58:55,5,"运行速度：非常流畅，性能稳定，感觉挺好用
屏幕效果：2.5k屏幕完美，比较清晰
散热性能：还可以，比较好
外形外观：赞美
轻薄程度：还行不算太重"
186,15628262135,2021-05-03 11:22:15,5,"运行速度：很快，毕竟有mx450的加持 AMD的u也不错
屏幕效果：2.2k色彩丰富，显示的很好
外形外观：深灰色，大气
轻薄程度：比Pro16更加轻便
其他特色：真-轻薄本也能玩大作 性能妥妥的。
 总体，还是不错 希望联想再接再厉。"
187,15653384383,2021-05-09 22:32:52,5,"运行速度：速度很快，办公轻松。游戏响应速度也很快。
屏幕效果：显示效果很好，室外也很清晰，无反光。
散热性能：办公无声音，散热很好。游戏也无发热。
外形外观：外形简洁，手感较好。非常适合办公+适度游戏。"
188,15630381840,2021-05-03 21:27:55,5,首先，给快递小哥点赞，快递小哥真的服务好，电脑上午就验机，没有任何问题，鲁大师评分将近100w分了，运行速度很快，aspen，cad，chemdraw等软件完全带的动切太顺畅了，自认为不是很重，很好，看以后用怎么样
189,16595153451,2021-11-07 20:30:37,5,"运行速度：在这个价位来说已经是很好了。
屏幕效果：屏幕效果还是挺清晰的。
散热性能：还可以"
190,16433861215,2021-10-08 20:03:47,5,"运行速度：流畅
屏幕效果：清晰饱和
散热性能：安静优秀
外形外观：简洁大方
轻薄程度：携带方便
其他特色：90hz刷新率+2.8k，低蓝光护眼，屏幕素质很优秀，各方面都很均衡，做工品质也不错，几乎没有缺点的机器，非常喜欢"
191,15808468813,2021-06-15 09:19:23,5,大屏幕玩游戏就是爽，尤其120Hz很流畅，处理器性能很强大，显卡也不错，玩魔兽第一次特效全开，爽歪歪，光数框框就很爽
192,16490190047,2021-10-20 14:30:43,5,"运行速度：挺快的，毕竟是固态硬盘，速度杠杠的！
屏幕效果：很不错，比之前的tn屏好太多了
散热性能：只是用来工作，不打游戏，不会很烫
外形外观：简洁，金属壳看着舒服
轻薄程度：轻！也薄！符合需求！
其他特色：就是预装的Windows11有很多bug，等更新吧只能"
193,16039049234,2021-07-25 19:58:57,5,"很好
运行速度：运行速度：运行速度 很快，开机快
屏幕效果：很清晰，桌面也好看
外形外观：很好看，很薄，带着很方便，充电器也很好用，充电器颜值也很好
总之很满意，小新这款已经买了两台了，爱了爱了"
194,15805817990,2021-06-14 15:43:17,5,"激动的心颤抖的手，等了好久终于收到货了，抽到了三星的硬盘，3050够用了，很可以，屏幕素质很强，也不大，16寸比我的老古董15.6的还小一圈，重量也不重，
散热性能：散热可以，风扇声音不大
屏幕效果：很清楚，看完了在看720无法直视
运行速度：AMD，YES！
轻薄程度：不重，满意。麒麟臂单身没问题。"
195,15842523085,2021-06-20 23:41:02,5,为了建筑设计画图购买的 6.1预售 6.11下单 电脑已经收到了 外观很漂亮 重量也可以接受 没有想象中的那么笨重 尺寸很大 适合作图用  还没有开机激活  希望可以流畅运行设计类软件 期待！
196,16447817939,2021-10-11 18:05:39,5,从R9000P 2021换来，包装很精致，质量很轻，背着也不会有沉甸甸的感觉；5800H处理器感知很强，又很省电，充电一次续航好久。在外只需要背1个100W氮化镓即可，再也不用体会游戏本厚重的感觉。
197,15627003547,2021-05-02 22:07:14,5,哈，开机速度不错，运行也流畅，办公用的，要求不高，抢不到小新16pro，退而求次买了这款，机身超薄，运行起来很安静，HD分辨率的雾面屏，看起来挺舒服，很意外，居然有键盘灯的功能，不过键盘不是防水的，看来要买一块垫资！
198,16420380633,2021-10-06 13:08:29,5,"屏幕效果：非常好
外形外观：精致细腻
轻薄程度：轻薄不重"
199,15846952227,2021-06-21 18:59:20,5,"屏幕效果：屏幕素质特别好，分辨率高，清晰流畅
运行速度：运行Adobe系列软件特别流程，设计人不错的选择

外形外观：在这样的性能加持下，整机还算轻薄，支持PD充电，好评！"
