,ID,发表时间,满意度,评论
63,15637161043,2021-05-05 18:39:16,5,一直在等一个屏幕16寸，CPU强劲的本子用于产品开发。16:10的屏幕无论在观感上还是办公效率上都非常NICE，16:10绝对是趋势。先喊一句AMD YES！，5800H在单核和多核性能上都非常强，对比我台式机的i5-7500（和7代对比貌似不公平），Matlab代码生成的速度快了1倍（单核），Keil编译代码的速度快了3倍（多核编译），把工作所需的软件都打开也是流畅运行，只是16G的内存占用率90%+，不太够用。使用一天，各项非常满意，以后继续支持联想（主要是太香了 ）。
64,15800266228,2021-06-13 09:56:25,5,"6月1号付完尾款，2号就收到?了，京东配送员速度一如既往的赞！
金属机身，雾面屏，用起来很舒服。
优点：1、2.5K屏幕，非常清晰细腻；2、Tof镜头非常好用，识别速度非常快；3、运行速度相当可以，我主要是用来日常办公，以及玩英雄联盟（特效全部设置最高，可以稳定在160～175FPS），能够很好的满足我的使用需求；4、官方壁纸好评（属实是让联想整明白了，拯救姬yyds！）
缺点：玩游戏时风扇声音偏大，日常办公跟看视频就基本没影响。"
65,15380879669,2021-03-04 18:57:23,5,首次开机根本没有什么声音，哈哈哈，收到本子就迫不及待的打开设置，键盘真的超级好用舒适，好开心抢到了首发，容我再好好探索探索它&hellip&hellip
66,15848043582,2021-06-21 22:05:53,5,性能不错  日常办公很好   游戏玩的不多  外形很好  满意  大有小键盘 就是便携性下降了
67,16435864210,2021-10-09 08:40:21,5,电脑很不错挺喜欢的，开机速度快，用了哈都很满意，尤其是那个键盘，已使用就会亮，超级爱，喜欢的伙伴可以下单了，不会失望的。
68,15844726321,2021-06-21 12:34:07,5,小新pro16非常符合我的要求和预期，等了这么长时间终于等到一台价格配置适合我的，金属机身+非游戏本的外观+还行的性能，完美  又买了小新支架 刚好适配哈哈哈
69,15632047333,2021-05-04 12:17:05,5,介于便携本和游戏本之间的高性价比笔记本，屏幕非常nice，外观也很fashion。作为带娃族，只要不玩3A大作，显卡足够用了。屏幕大一点，也可以让娃上网课不那么费眼。总之，适合的就是最好的！
70,15626169503,2021-05-02 17:55:50,5,笔记本拿到手很轻，画质非常好，屏幕够大，性能强悍，还是16:10，人脸识别也很灵敏，性价比超高，键盘也很舒服，金属壳非常有质感，这款笔记本太适合我了。
71,15826981548,2021-06-18 13:10:27,5,"运行速度：快到飞起，可以说是最快的小新了
屏幕效果：超大的高清屏幕。从小新潮5000换过来，感觉屏幕清晰细腻了不少，高刷新率也带给了我不一样的体验！
外形外观：外观就很规规矩矩很方正，适合学生党
轻薄程度：算是高性能轻薄本中的佼佼者啦"
72,15636636034,2021-05-05 16:25:34,5,5.1首发抢到，屏幕素质高，2.5k120hz高色域16寸大屏，支持杜比全景声音响，看电影追剧都很爽。GTX1650显卡R7  5800h8核16线程cpu，鲁大师跑分94万，游戏办公都够用了。16g内存，512g固态也足够了。相信联想品质，售后无忧。首发价格还是挺香的！
73,15839693575,2021-06-20 15:30:20,5,今年非常期待的笔记本电脑，非常喜欢这种类型的全能本属于什么都能干的本，等了好久终于买到了，物流也非常快很快就到手了，虽然算是游戏办公全能本，我是买来学习的，哈哈哈！！！
74,15774286045,2021-06-07 15:16:49,5,"运行速度：amd yes r5续航也相对不错，兼容性基本都做得很好，非常流畅，120hz也很舒服，西数730一如既往；镁光内存很快；smp电池第一次用，有待后续体验再评论，苹果电脑也有采用这个牌子应该问题不大
屏幕效果：屏幕120hz不错，之前电脑总会有供应商差别，这次干脆联想用的自家联想屏幕，就这几天使用感受目前没有出现任何问题
散热性能：散热因为后部两个风扇，虽然局部依旧温度很高，但是如此强劲性能下做的很不错了，毕竟联系采用希腊神话风神作为代号
外形外观：和之前差别不是太大，但是简答大方，很不错
轻薄程度：毕竟定义全能本，体积和质量控制得很不错了，4kg，16寸，16:10很舒服
其他特色：都是1.3mm键程，比之前手感好很多，屏幕还是雾面屏反光效果会好些。这几年不论游戏本、轻薄本都是联想主场，希望联想再接再厉，更创辉煌！
京东物流一如既往快速，售后保证，也希望大家在贵重物品尤其电子产品方面还是从京东上购买，各个方面可以得到保证。"
75,15706487662,2021-05-22 23:31:29,5,用了一段时间了，使用体验总体来说不错，没打过游戏，看电视办公非常流畅。外观低调内敛有质感。键盘手感很好，独立小键盘很加分。
76,15642749583,2021-05-07 09:00:55,5,一直对电脑没什么研究，问东问西，好多人都说小新口碑还不错，刚好有Pro16首发，看了好多天直播，越看越符合我现在的需求，能办公能玩游戏，5月2号就到货了，收到货检查了一下，各处都很完好，屏幕清晰度不错，观看视频也很流畅，整体金属质感很好，很喜欢。新Pro16的外观和设计很精致，使用触感细腻，性能优越，外出携带也方便，大爱
77,15669593373,2021-05-13 23:43:26,5,"首发没买到亏了五百，气哭。
本子质感很不错，比我以前的荣耀材质好。
屏幕很不错，2k屏120刷新，dc调光。
键盘手感也比我以前的荣耀好很多，不会软绵绵的，这个键盘反馈挺明显的。
触摸板也更好一些，触控移动的很准确。
最后1650玩街霸5特效全开能玩。"
78,15774952913,2021-06-07 17:35:36,5,"种草蛮久了 所以第一时间就入手了，性能很强，做工也很好，这屏幕看着相当舒服，没有漏光情况，别的游戏没测 但lol的话最高画质下140帧左右 总之相当满意 值得入手
屏幕效果：很好
运行速度：快
散热性能：强
外形外观：好看"
79,16554828949,2021-11-01 20:31:16,5,"屏幕效果：非常好，漏光可以接受
外形外观：非常不错，自己很喜欢
就是得了个win10版本的，还以为会全部是win11的，要自己升级"
80,16425003073,2021-10-07 08:46:57,5,首发抢到，5号付完尾款，6号就用上了。2.8k屏很不错，夸父桌面好看。首次开机也没出现特别大风扇声，速度很快，win11目前使用还好，任务栏比较习惯。笔记本很轻便，比5年前13寸笔记本没大多少，重量控制也不错
81,15693816063,2021-05-19 21:57:38,5,"运行速度：非常快
屏幕效果：清晰细腻
散热性能：非常棒
外形外观：稳重大气
轻薄程度：适中，最适合放在家里使用，出差偶尔用一下可以，不建议作为出差常备
其他特色：键盘回馈力度恰到好处，舒适度一流。总之，联想小新pro16是我用过的最好用的本子之一，首发抢到就是赚到！"
82,15752852782,2021-06-03 07:59:13,5,"运行速度：运行速度非常快，鲁大师跑分66万
屏幕效果：15的大屏幕看的就是爽，看电影也很清晰
散热性能：有三挡可调节，平时开普通模式，基本听不到风扇声音
外形外观：很帅，原本以为灰色不好看，磨砂质感很好
轻薄程度：特别轻，携带出门办公看电影啥的，都很方便，一只手就能拎起来"
83,16644548638,2021-11-14 21:18:02,5,电脑很好，屏幕很清晰，画面很清晰，流畅，办公合适，性能强，正品，笔记本可以，手感好，携带方便，真的很推荐，手感很好，好用包装精美，完了一局游戏，真爽，感觉不出延迟，鼠标很轻便，目测我会拆机重新Y兰半，值得再次入季 shǒu
84,15624861492,2021-05-02 11:04:51,5,首发抢到了小新pro16！5.1下单，5.2就到了，迫不及待来晒单分享！屏幕没坏点，硬盘完美，新版鲁大师跑分有90万，6000元价位的笔记本还要杀自行车？可以说已经杀疯了，包装盒也很好看，客服小姐姐和京东配送都很给力，不多说了，看图吧～
85,16436094764,2021-10-09 09:43:00,5,联想小新pro14 R5，超流畅，速度也很快，就是系统跟新的速度快的出乎意料，其余的感觉都很不错，看视频超好的，推荐买一个
86,16451939107,2021-10-12 18:10:34,5,外观好看，携带方便，配置方面不错，玩游戏，办公不错，速度很快，续航时间也挺长，挺满意
87,15626244198,2021-05-02 18:16:51,5,今天刚到，外观很合胃口，上手体验很好，屏幕，音响这个价位应该是无敌了吧，很流畅，抢到很满意?
88,15624633141,2021-05-02 09:58:48,5,"非常不错的一款轻薄本，满足了我所有需求，还可以打游戏。
非常满意，小巧，简约，性能强大，这个性价比挺高的，适合办公与游戏兼存的需求，运行速度也很快，强大啊，值得购买。
跑分的话个人觉得比pro14一点都不弱，毕竟价格在这
屏幕效果：画质不错
散热性能：风扇声音比较小
运行速度：快，开机5秒，打开网页1秒"
89,16421813532,2021-10-06 16:42:43,5,笔记本很轻，携带很方便，屏幕很清晰，单手就可以开合盖子，特别的方便！处理器很强大。响应速度很快！特别适合入手！键盘手感还不错！
90,16421839066,2021-10-06 16:46:06,5,首发买的，付了尾款第二天就到货了，迫不及待开了箱，金属机身很薄也很轻，做工精细，刚刚上手感觉不错，R5已经足够了，反应很快，发热没那么严重散热不错，希望AMD不会有太多bug，屏幕很棒2.8k高刷感觉很精细，win11初上手感觉也不错，老电脑可以退休了。
91,15727803209,2021-05-28 09:28:41,5,"电脑很轻薄，铝合金质感不错。数字键盘布局很均匀，手感不错，自带的联想管家挺好用很满意，这次购物总的来说挺满意。
运行速度：飞一般的感觉。
屏幕效果：屏幕很细腻。
散热性能：散热声音很小。
外形外观：一个字，漂亮。
轻薄程度：一个拇指的厚度。
其他特色：安逸，体验不错?！！！"
92,15668383720,2021-05-13 18:00:26,5,"5月1日0点抢到的人生中第一台真正属于自己的笔记本，10几年之前用过一台联想的二手本子，就是听听歌曲 看看电影，也没什么特殊的感觉。也对比了很多牌子，最终还是选择了老品牌。由于工作要求，所以对笔记本的要求就是颜值高 轻薄 带独立显卡 独立小键盘 最重要的价位适中
，小新pro16基本上满足了我所有的需求。既能玩玩一般的游戏 也能画画CAD 还能PS修图。真是一台综合性 性价比 相当强的笔记本。本人非常满意！
京东的服务是相当满意。"
93,16422644880,2021-10-06 18:47:20,5,"外形外观：屏幕很漂亮啊，感觉色泽非常鲜艳。
散热性能：风扇一直转，第一次买笔记本也不太懂。
运行速度：很快。
屏幕效果：可以切换成90hz刷新率。
其他特色：预装win11系统，感觉很功能很好用。"
94,16617484054,2021-11-11 10:19:58,5,"外形外观：这款手提电脑外观设计漂亮质感不错！大气沉稳霸气侧漏！
运行速度：电脑运行速度快儿子很喜欢，说足够上大学用的了。
散热性能：电脑散热功能也可以，比较快，以前买的笔记本电脑散热**慢，非常影响使用！这款相对来说很好！
屏幕效果：电脑屏幕清晰度强，不用太刻意看就很清楚，这样可以减少用眼过度劳累。
轻薄程度：笔记本电脑很薄，携带方便。
其他特色：这款电脑是在实体店看好之后从京东自营店买的，首先产品质量有保障，安全放心！而且京东物流也很快很方便，选择性很好！支持京东。"
95,15872865147,2021-06-26 14:37:38,5,非常好，顺滑，新机，游戏不卡，好喜欢，表面光滑，键盘舒服，充电快。
96,15998639056,2021-07-17 22:22:48,5,联想小新Pro16高性能游戏轻薄本，16英寸全面屏笔记本电脑6核R5-5600H 16G 512G 2.5K高刷屏 GTX1650锐龙版，机器配置不错，性价比高，超薄本重量适中，办公方便，便于携带，京东活动抢购的，非常不容易，抢到2台，棒棒哒。
97,16570686655,2021-11-04 04:39:51,5,"千呼万唤才到货
外观：轻薄 金属感好
启动：速度快 nv2夹持 就是好
散热性能：还不错 半小时 总体不烫手；
屏幕效果：字迹超级清晰 完美高清屏幕
运行速度：很快 对得起这个价格
其他特色：充电器 超薄设计"
98,16413459218,2021-10-05 11:11:33,5,我太爱这电脑了 小新的顶配 就是爽 无论是外观屏幕还是运行 太棒了 爱了爱了 ，散热也很好 玩普通游戏完全没问题 而且很薄真的很薄 灰常喜欢
99,15625713048,2021-05-02 15:40:31,5,"运行速度：很流畅，没有卡顿
屏幕效果：2.5k的雾面大屏，120hz高刷，看起来很爽
散热性能：散热效果不错，没有之前用的三星那么烫
外形外观：金属机身，很大气
轻薄程度：是款轻薄全能本"
100,15635876851,2021-05-05 12:58:00,5,成功抢下小新pro16独显版，跟在用的thinkpad T570比较下，AMD yes！金属机身冰冰凉，重量可以接受，16寸大屏幕素质优秀，dc调光对眼睛健康些，GTX1650+高刷对游戏体验更佳，算是一台全能本，首次体验联想管家应用，像开机加载项监控，特色功能还挺惊喜的，JD当天送达也是加分，整体满意！
101,16585277719,2021-11-06 11:17:34,5,"运行速度：运行速度快，且十分稳定；
显示效果：十分细腻，不卡顿，线条流畅；
外观设计：金属设计，十分大气，很有质感，超级轻薄；
整体感觉：是理想的笔记本，超级满意！"
102,16446112929,2021-10-11 11:10:10,5,"运行速度：快
屏幕效果：2k 90hz无比丝滑
散热性能：两个风扇应该能压住
外形外观：简约大气时尚
轻薄程度：不到3斤，妹子携带很方便"
103,15796231140,2021-06-12 10:40:59,5,"兄弟们我来了，我是6月1号首发抢到的价格6499，今天开箱使用，外观和屏幕素质完好。
说说使用感受
1.键盘挺好的我觉得比一般的轻薄本好
2.屏幕画面很细腻，色彩也很好
3.噪音在正常轻度使用的时候几乎是听不到的，家里冰箱比散热声音大。
4.刷新率体验很棒120刷新率就是浏览网页，进入程序菜单都很流畅丝滑。
5.我之前很纠结买个y9000p，r9000p的，因为没抢到我就买了pro16，不做3d类的，平面设计，插画，flash动画，Ai制图，完全没有问题，咋说也是30系列显卡，玩玩网游没啥压力，我主要是拿来办公的，画画图，做做矢量图什么的。
6.不知道后面使用会怎么样，有什么最新问题我会在追加评论，希望对大家有参考。"
104,16433861090,2021-10-08 20:03:20,5,电脑非常不错，发货速度也很快，90hz高刷非常流畅，屏幕很清晰，还能人脸识别，非常不错！
105,15758672847,2021-06-04 10:55:37,5,"非常好，好不容易抢到。下午付尾款，第二天一早就到。
运行速度：很快
屏幕效果：超赞，就是看中这屏才买这款的
散热效果：还没用上野兽模式。
总体评价性价比不错，值得出手"
106,16633462280,2021-11-13 12:08:32,5,电脑很轻薄，拿到没有损坏，质感很好，除了第一次开机会久一点，之后开机都很快！这个价位买到8核的真的很优惠！屏幕显示很好，使用起来很方便！
107,16235625234,2021-09-01 19:00:52,5,屏幕2.5k的体验感非常好，16英寸的屏幕办公用起来如鱼得水。独立显卡应付游戏绰绰有余，厚度也很合适。非常推荐购买。机器太抢手了，预约抢购了二轮才抢到手，不容易哦
108,16425189492,2021-10-07 09:42:35,5,"屏幕效果：2k屏幕显示效果很好，细腻。
散热性能：D面大面积散热网，不惧高温。
外形外观：简约商务，金属手感很好。
轻薄程度：不到3斤，十分轻薄便携。
运行速度：锐龙处理器性能优于同级别因特U。"
109,15646078957,2021-05-08 00:00:57,5,第一次买笔记本，了解一段时间决定买联想，小新系列一直比较喜欢，平时主要使用PS，AI很快很流畅，轻度使用**D也是完全没问题，屏幕效果非常好，首发价抢到感觉很值！
110,15624053168,2021-05-02 01:06:00,5,考虑很久还是入手了小新pro16，下单第二天就到了，京东物流还是挺快的，金属机身比较喜欢，性价比超高，全尺寸背光键盘超级好看，接口也比较丰富，小键盘设计是最喜欢的一点。
111,16426073831,2021-10-07 12:59:30,5,京东送货好快，第二天就到了。一拿到手里就被惊艳到了，质感很好，屏幕也很大，很清晰，运行很流畅。喜欢喜欢！
112,15876164735,2021-06-27 08:21:48,5,笔记本收到了，一直在关注终于遇到自己喜欢的，首发性价比很高，买到就是赚到，收到后很满意，支持联想
113,15626787390,2021-05-02 21:02:47,5,"首发价买到了小新Pro 16，R7 1650 120Hz的版本。
上手体验非常好，在6K的价位，性价比无敌。外观低调沉稳，简洁大方，触感细腻带一点冰凉。屏幕2.5k的分辨率，120Hz的刷新率，搭配窄边框，支持杜比音效看电影的沉浸感非常好。键盘敲击感中规中矩，触摸板使用起来也很方便，全尺寸方向键好评。性能方面，超过了轻薄本的范畴，介于轻薄本和游戏本之间。LOL最高特效无压力，3A大作据说能玩最低特效，没有尝试过。剪辑视频速度快，3D max建模也很流畅，之前的全都不能本终于有了全能本的感觉。
总体来说，6k价位的不二选择，推荐各位小伙伴购买。冲冲冲！"
114,15810394578,2021-06-15 16:05:04,5,灰色的金属外壳质感很高级，整体做工不错，运气比较好，抽奖三星ssd，螃蟹网卡差点意思。这个价位16寸大屏真香，还是16:10的，办公码代码很舒服。
115,15669716532,2021-05-14 01:00:06,5,"1.京东小哥送货很快，屏幕很好，特别是120HZ，用起很舒服，但有点偏黄，不过可以用屏幕颜色校准进行调整。
2.性能很强，比我之前的PRO13 快很多，质感好了不少，键盘手感也好多了，感觉完全可以替代台式机。
3.平常办公用省电模式完全够用了。
4.美中不足：加上电源，比轻薄本重多了，而且之前买的65W充电器也用不了了。"
116,15624828076,2021-05-02 10:56:13,5,"运行速度：运行速度很快，A加N组合很完美。
屏幕效果：16寸2K高刷屏办公、游戏、看影视剧都很不错。
散热性能：目前这个室温散热还不错，看看夏天怎么样。
外形外观：沉稳偏重商务风格
轻薄程度：重量不能算轻薄了，看个人需求了。
其他特色：人脸解锁不错，用起来方便。"
117,15636972852,2021-05-05 17:49:09,5,"首先外观，非常有质感，看着很舒服
其次性能，非常棒A+N，绝配，性能够用，毕竟我只打csgo,lol
最重要的是这个屏幕了，16:10.很舒服，显示面积很大，2.5k，屏幕很细腻。
最后用了两天下来，舒服很快，屏幕素质很好，按键可以，瞬间跟我6年的电脑不同的感受。"
118,16048683991,2021-07-27 21:01:27,5,"运行速度：很快，比我那台旧电脑快多了
屏幕效果：颜色很饱满，很舒适
散热性能：目前散热挺好的
外形外观：美观大气，谁用都合适
轻薄程度：很轻薄，完全是个女孩子提
其他特色：还赠送办公软件，太贴心了"
119,16426504349,2021-10-07 14:11:26,5,颜值超出我的预期，不错，重量还行，不是很重，14寸非常合适。
120,16433916370,2021-10-08 20:17:58,5,小新pro 14 新款笔记本，屏幕升级为2.8k分辨率，支持90hz刷新，dc调光，10bit面板，色彩饱和，显示效果非常细腻，看着非常舒适。AMD5600h标压处理器，性能还可以，日常绝对够用了。
121,15762207744,2021-06-04 23:40:57,5,机器做工非常好，硬盘速度很快，1650玩大多数游戏都没问题，完美屏，16：10看着很舒服，雾面屏也没有反光问题，完全就是我想要的机器。
122,15656886142,2021-05-10 20:11:15,5,"绝对是物美价廉，性价比无敌！
1.屏幕没的说，高刷屏幕，高分辨率，喜欢！
2.处理器太厉害了AMD yes！
3.散热很棒，这个很重要，三亚天气一年都热！
4.游戏好多都可以畅玩，这个很重要！
5.噪音控制无敌，比游戏本好！
一句话，超喜欢！"
123,15828710769,2021-06-18 18:28:57,5,"16寸2.5K屏，屏幕大，看着舒服，分辨率高，很不错
散热好，整体运行起来没有过热
电池容量大，待机时间长
显卡配置高，整体很满意"
124,16031024657,2021-07-23 22:24:47,5,很喜欢，也很喜欢颜色，样式也很喜欢，大小也正好！！非常非常非常喜欢。。。。真的很喜欢这个深空灰&hellip&hellip
125,16426775817,2021-10-07 14:57:15,5,"屏幕效果：很好，2.8k屏幕比以前的1080p的游戏本展示效果好很多
外形外观：银灰色，有点像Mac book
运行速度：5800肯定够了，很快。
散热性能：日常用基本上没啥声音"
126,15653170930,2021-05-09 21:38:49,5,"1.性能非常强劲，AMD5800+独立显卡的配置，估计够用很长的时间，响应非常快。
2.外观简约时尚，非常商务的设计风格，个人非常喜欢的。
3.16英寸的笔记本，原本以为是非常大的一个尺寸，但实际情况是并不是太大的，整体的重量和尺寸在便携性上还是不存在什么问题的。
4.屏幕效果非常好，120hz的2.5k屏幕显示非常细腻，看球赛和电影都一流的。
5.散热效果不错，一般办公并未感受到明显的发烫，不错。"
127,15640619671,2021-05-06 16:45:22,5,我凌晨没抢到，然后等到下午9点的时候，我随手一刷，刚好刷到一台就赶紧买了。这台机器是今天下午到的。机器挺漂亮的，呃，重量我也算能接受。开始以为不能调分辨率，但是自己摸索了一会，发现可以调分辨率挺好的。嗯，也可以调成60刷新率。电脑屏幕以及各项设施都挺不错的，嗯，我这台发现也没什么大问题和缺点，作为人生中第一一台电脑，非常可以，很棒！京东自营服务我也很喜欢， 我吐槽一下，它这个充电器重量挺轻的。反反正我不觉得这个大很小。非常好，
128,15756983911,2021-06-03 22:17:18,5,"外形外观：高端大气上档次，很满意，手感很好
轻薄程度：还可以，有一点点重
运行速度：很快
屏幕效果：很好
散热性能：键盘上端会发烫，程度还可以接受
这两个月一直在看电脑，主要用于办公，但由于工作性质决定对电脑配置有一定要求，最终决定了买这款，性价比很高，很满意"
129,15449117105,2021-03-22 14:08:58,5,"运行速度：快
屏幕效果：清晰
散热性能：好
外形外观：小巧精致，便于携带
轻薄程度：非常轻薄

同学推荐，上手后果然效果不错，很棒！物流超快！非常满意！"
130,15652929179,2021-05-09 20:35:44,5,当之无愧的水桶！4800H 性能没得说，媲美台式机，秒杀英特尔；16寸 120赫兹刷新率2.5K屏幕，又大又细腻又流畅，雾面屏防眩光，真正的干活利器；GTX1650 塞进 16.9毫米的机身，性能释放还能达到80W，在轻薄本中已经算超强显卡了，甩 MX450 几条街，干重活也无压力。这款算是今年的完美轻薄机，也是我心中的理想机器，战五年不是问题！AMD YES！
131,15439378591,2021-03-19 19:53:53,5,笔记本电脑非常不错，手感很棒，性能也刚刚好，联想小新Air14笔记本3999买的还是非常划算的，绝对是非常超值的
132,16438331318,2021-10-09 17:50:27,5,"机器已经收到了，整体还算满意。
目前看起来还算流畅。金属外壳很有质感
性价比超高 也不卡挺好"
133,16414989390,2021-10-05 16:37:39,5,"运行速度：非常快！几秒钟开机启动
屏幕效果：屏幕2.8k简直爽爆真香系列轻薄本
散热性能：这款机器两个大散热口真的惊艳到我了！美滋滋
外形外观：一个字：绝！实在是高端大气上档次！"
134,15829599241,2021-06-18 20:58:38,5,首发买的，用了一段时间很不错，玩游戏，办公是真的好，速度超级快，R7-3050这个价位美美的。
135,15675251205,2021-05-15 13:58:15,5,收到电脑非常喜欢，游戏本的性能，商务本的外观设计，跑分也很给力，大赞??
136,15639970315,2021-05-06 13:55:17,5,"联想小新air14plus真的很不错，开机可以人脸识别，几秒钟就开机了，还有指纹解锁，开盖就开机
运行速度：快，好用
屏幕效果：2.2k的屏幕，使用感好
轻薄程度：轻薄本，适合携带
外形外观：简约灰色，大方"
137,15751555267,2021-06-02 20:56:52,5,笔记本非常轻薄，颜色很漂亮，做工很精致，特别喜欢，一开盖它就自动开机，反应速度特别快，显示器显示很细腻，鲁大师跑分70万以上，特别优秀，16寸的显示器无论办公娱乐都很棒，
