,ID,发表时间,满意度,评论
0,16600808320,2021-11-08 18:01:13,5,"笔记本拿在手上手感很好，这摊上京东促③ 6 o 0能拿到，真是美美哒，法评论图视频看的。预装win11系统，开机然后各种设置，一切正常，屏幕看起来很不错，色彩很鲜艳，比以前的旧电脑好太多了，配的充电器也是便携的，很方便，唯一的就是接口比较少，需要买个拓展坞，不过整体很不错。很轻薄的本本, 非常适合学生党使用，操作起来挺舒服的，它的键盘。用起来也挺顺手的，没有什么硌手感。屏幕尺寸也特别舒服，特别合适。背在书包里也不是很重，很适合出行旅行。整体感觉还是挺不错的。隔天就送到了，速度很快，电脑用起来速度很快，满足日常办公需求，看视频也很快，很好，联想电脑好用，京东服务也很好！真香，外观轻薄，金属材质，有档次！最新cpu带指纹识别，16G 内存，512固态，运行速度飞快，赞一个，最喜欢的是高色域屏幕，用来看视频真的爽，测试过待机，结果令人满意。这应该是最香的一款机器了。而且联想品质值得信赖，推荐！散热很好，不卡顿，办公学习打游戏统统没问题，屏幕不伤眼睛，外观时尚、轻薄，对女生来说，大小合适，颜值很高哦，真的超级超级喜欢"
1,16418945547,2021-10-06 09:37:05,5,"运行速度：快
屏幕效果：2.8k非常细腻
散热性能：棒
外形外观：特别轻快
其他特色：win11 清新不错
物流第二天就到了，特别快 联想品质值得信赖
轻薄程度：轻薄，便携，显示效果好，上个电脑是7年前的，哈哈哈"
2,15891823213,2021-06-29 20:04:45,5,"很轻薄的本本, 非常适合学生党使用，操作起来挺舒服的，它的键盘。用起来也挺顺手的，没有什么硌手感。屏幕尺寸也特别舒服，特别合适。背在书包里也不是很重，很适合出行旅行。整体感觉还是挺不错的。"
3,15848485891,2021-06-21 23:42:17,5,京东618下单，隔天就送到了，速度很快，电脑用起来速度很快，满足日常办公需求，看视频也很快，很好，联想电脑好用，京东服务也很好！
4,16427397227,2021-10-07 16:33:51,5,首发抢到小新pro14高刷版，5号付尾款，6号就收到了，笔记本拿在手上手感很好，预装win11系统，开机然后各种设置，一切正常，屏幕看起来很不错，色彩很鲜艳，比以前的旧电脑好太多了，配的充电器也是便携的，很方便，唯一的就是接口比较少，需要买个拓展坞，不过整体很不错。
5,16434506961,2021-10-08 22:44:12,5,"外形外观：外观简洁小巧，更喜欢深空灰，有点可惜。
屏幕效果：2.8k的屏幕看起来真的很清晰。默认60HZ，需手动开启90HZ。
运行速度：运行流畅，兼容性很好。60万出头跑分，还算正常发挥。

其他特色：office完美激活。喇叭在底部两侧。"
6,15839376121,2021-06-20 14:34:40,5,没想到618速度这么快，真香，外观轻薄，金属材质，有档次！最新cpu带指纹识别，16G 内存，512固态，运行速度飞快，赞一个，最喜欢的是高色域屏幕，用来看视频真的爽，测试过待机，结果令人满意。这应该是最香的一款机器了。而且联想品质值得信赖，推荐！！！
7,16438988049,2021-10-09 20:34:54,5,第一次用联想的笔记本，很好，安静模式，很安静，几乎听不到声音。野兽模式也挺只能，不是一味的呼呼转。屏幕是亮点，很细腻。玻璃的。挺高级的。使用感受，以后再看。
8,16455858973,2021-10-13 14:52:09,5,总体不错，轻薄，屏幕好，运行速度快。第一次开机风扇声音很小！配置也比较满意。为直播间主播点赞本来9月份要买来，主播说26号有新款发布！等了1星期，新款价格便宜，配置还高了！说一下激活，基本都是联网注册登录自动激活！包括office，比我去年买的小米笔记本激活方便朵多了，咨询了几次客服，也比较有耐心，总体满意
9,15832906335,2021-06-19 12:41:39,5,"联想小新笔记本电脑很棒，家用非常快，收到电脑，按照说明激活windows10和office，放歌音质很好，自己把D盘分区，
运行速度：快
屏幕效果：色彩好
轻薄程度：非常轻薄"
10,16460457985,2021-10-14 15:07:26,5,"自己不太懂电脑，专门咨询家里人买的。性能，内存都是很好的，相对价位下是最实惠的，性能好，运行快
屏幕效果：清晰
外形外观：好看
运行速度：快 流畅
轻薄程度：轻薄"
11,16438564935,2021-10-09 18:42:30,5,"运行速度：速度还挺快的，开机也挺快
屏幕效果：屏幕正好不小
散热性能：现在没什么问题
外形外观：银色很好看，简约大方
轻薄程度：女生拿着ok的
其他特色：整体还是可以的。"
12,16181462431,2021-08-23 11:08:46,5,散热很好，不卡顿，办公学习打游戏统统没问题，屏幕不伤眼睛，外观时尚、轻薄，对女生来说，大小合适，颜值很高哦，真的超级超级喜欢?。
13,15876952146,2021-06-27 11:23:26,5,"运行速度：丝滑流畅
屏幕效果：饱满细腻
散热性能：安静省心
外形外观：小巧玲珑
轻薄程度：适宜携带
其他特色：office激活简易
目前使用很满意"
14,16462267206,2021-10-14 21:57:43,5,"轻薄程度：选电脑真的艰难，从完全不懂，到一个星期内看各种视频已经都看懂了，小新这个在同类型中是厚度和重量是控制的很好的，在线下看的时候就相中了，又正好碰到有高刷版上市，果断抢购。
外形外观：外观方面很精致，细节都不错，没有其他问题。
屏幕效果：2.8k的高刷屏当然没话说，最佳了。
运行速度：最新的11320处理器，嗖嗖的！而且有人脸识别，非常的方便了。"
15,16307406971,2021-09-15 12:04:49,5,京东物流很快，第二天就送到了，好评！刚刚拿到机子，十代I5处理器，比我台式机的i7还快，运行比较流畅，安装软件不卡，非常快！吃鸡没有问题！我使用CAD和广联达非常顺畅，开图秒开啊！MX350显卡加持，当然差不了！屏幕效果没得说，高清看电视弹幕没有拖影，亮度最大也不刺眼！比想象中薄一点，还没有我看的书厚，上一款用的是ThinkPad，比这厚一倍。
16,16443838689,2021-10-10 19:09:35,5,"以前用的游戏本，太重了。打算换轻薄本，选的小新14pro。说说满意的几点：
1屏幕2.8k，高色域，ips屏幕，效果很棒。
2重量轻，i5-11320h，锐炬显卡，性能释放够用。
3人脸识别，开盖开机等功能非常实用。"
17,16422162380,2021-10-06 17:26:08,5,"运行速度：酷睿i5-11320版本，办公和日常够用。
屏幕效果：90hz刷新率，400nits亮度，2.8k分辨率，目前商务办公本最高的屏幕，非常细腻，观感非常好。
散热性能：散热可以，风扇声音不大。
外形外观：全金属机身，浅灰色，非常漂亮。
轻薄程度：1.4千克，可以单手开合，pd充电器65w也很轻。
其他特色：双雷电4，但是接口不够，需要买拓展坞。
首发5299入，10月5日尾款，10月6日到货，非常满意。"
18,16296354628,2021-09-13 11:50:49,3,先用一段时间，后面在追评
19,16426867614,2021-10-07 15:13:57,5,其实自己并不懂电脑，但是相信联想的质量。机器外观很精致，很轻、很薄，手感很好。win11系统与win10区别还是挺大，还要适应一段时间。简单使用了下，操作起来速度还可以，基本满足使用。这也是精挑细选很久?，最后决定买这一款?，到货后果然没有让我失望，实物很漂亮?，满意?！
20,16449851799,2021-10-12 09:53:00,5,这款电脑抢到了首发，发货速度很快。新电脑到手了好几天，感觉还不错，金属的外壳，手感超好，开盖即开机，非常方便，自带win11系统，超级nice。充电器白色的，很好看也很小巧，携带非常方便。
21,16426724667,2021-10-07 14:46:23,5,颜值没的说，2.8K的屏幕绝对够清晰，屏幕边框很窄，人脸识别很好用，整机很轻薄，充电器也是65w的C口，不仅能充电脑，也能充手机，并且笔记本也支持关机给手机充电，i5十一代标压处理器性能够用，推荐！
22,16431963717,2021-10-08 12:54:52,5,"快递隔天就收到了，打开机器很新没有什么问题，按照流程激活了系统。是三星的内存，海力士的固态，因特尔的网卡，再加上windows11系统的体验也很棒，很容易上手，UI设计更美观了。轻度的游戏需求，lol,刀塔完全可以胜任，一些专业软件也可以，性能够用了，总体感觉很好。"
23,15868706965,2021-06-25 16:08:25,5,使用四年不到的老笔记本电脑突然开不了机，想想老电脑卡顿严重，干脆不修换新了，然后买了朋友推荐的这个款式，性价比高，颜值好看，运行速度快，总之是相当满意。
24,15834396631,2021-06-19 17:04:53,5,"运行速度：很快
屏幕效果：很清晰
散热性能：很好，全金属
外形外观：银色很时尚
轻薄程度：轻薄便携
其他特色：颜值高，配置好，价格实惠"
25,16279997392,2021-09-10 10:24:11,5,物流很快，客服很耐心，价格很适合，买来上学的，外观大气，给人特别舒服的感觉，运行特别流畅，机身轻薄，建议入手，电脑很不错，学习游戏基本都没问题，值得推荐。
26,16420429224,2021-10-06 13:15:10,5,"运行速度：运行速度是快的，同时打开好几个网页也不会卡顿
屏幕效果：玻璃屏很舒服，想手机一样
散热性能：还不错 一上午电脑也没热
外形外观：银色的外形，我感觉很好看，很大气简约
轻薄程度：很轻适合女生"
27,15891961032,2021-06-29 20:28:51,5,旧电脑有些卡了，看了半天相中这款。用了几天了，感觉还不错，速度快，使用方便，外观也很好，灰色漂亮，金属外壳质感好。激活、分区简单，客服指导非常耐心，点赞。618买价格优惠，物流也快，非常满意的一次购物。
28,15833782472,2021-06-19 15:20:11,5,电脑速度快，全金属外壳，对比了很多款最后选了小新Air15，大小合适放在背包里正合适，激活方便，下载了几个游戏完美运行没有压力，摄像头清晰，物流非常给力，真是物超所值。
29,15876216204,2021-06-27 08:35:13,5,"电脑很不错，尺寸15.6，但是一点都不重，屏幕品质可以，不伤眼睛。这个性能日常使用完全没有问题。
运行速度：很不错的呢
屏幕效果：护眼效果很赞，喜欢
散热性能：挺好的，不发热
外形外观：银色外观很好看"
30,16553848782,2021-11-01 18:05:18,5,昨天晚上付的尾款，第二天早上就到了，速度很快，银白色的外壳很好看，而且开机速度很快，激活程序也很简单~推荐
31,16464972429,2021-10-15 12:51:29,5,"运行速度：很快，不卡顿。
屏幕效果：2.8K高刷屏特别清晰。
散热性能：很好，开机运行后感觉不到热。
外形外观：特别漂亮，适合女生。
轻薄程度：轻薄本还可以。
其他特色：物流速度也可以，好评，推介购买。"
32,16429775247,2021-10-07 23:25:33,5,"还是一如既往的好，联想大品牌，值得信赖，机器不错，服务很好，
运行速度：快
屏幕效果：好
散热性能：好
外形外观：时尚"
33,15839040731,2021-06-20 13:35:43,5,18号凌晨下单   当天到货，物流超棒，电脑运行速度很快，外观大气，颜色漂亮，整体感觉都很不错
34,15891228145,2021-06-29 18:22:34,5,"轻！薄！耐！快！
轻薄的机身搭载着强悍的性能，高容量锂电池搭配65w超级快充使得不再续航焦虑，丰富的接口108全键盘以及指纹识别让使用体验更加便捷！
小新air15完全颠覆我对笔记本的看法
他就是他不一样的烟花?
***：日常办公excel处理文件啥的一点问题都没有，这个配置起码五年内都不会过时，体验很好（机身轻薄电池耐用还可以快充）搭配i5 11代处理器性能方面无需多虑，最后推荐购买便携充电器体验更佳！（一个充电头搞定电脑和手机双快充外出更方便）"
35,16107136189,2021-08-08 16:37:57,5,"用了一周了，没发现什么问题，机器便携，机身有质感，选了很久很多款，咨询了朋友，都推荐联想小新，配了联想的鼠标和电脑包，很喜欢！
运行速度：快
屏幕效果：很清晰
散热性能：不是太热
轻薄程度：轻薄
外形外观：金属质感"
36,16432192537,2021-10-08 13:52:39,5,性价比很高的产品，一出高刷的立刻就买了，笔记本轻薄，充电器也小。屏幕边框很窄，摄像头也放在了屏幕上方。相机打开时候灯会亮，就不怕有软件偷开摄像头。屏幕很清晰，镜面屏比雾面屏亮度高，更适合在比较亮的环境下使用。
37,16246492896,2021-09-03 22:08:22,3,感觉用电好快刚拿回来的
38,16598145027,2021-11-08 11:12:49,5,外观好看，银色，14寸太适合我了。可以单手翻开。运行也很快，一回来就连着听课了，续航也不错，放了一天的视频只有一点热，所以散热应该不错的。还有，就第一次开机按了一下开关键，后面开机都不用按键，一翻开自动识别脸部就开机了，?很方便。对于办公党来说已经很好了。满意！
39,15845648451,2021-06-21 15:15:52,5,"电脑收到了，包装好的很好，电脑速度很快！刚刚开机，只要几十秒时间，这款电脑是15.6寸的，带数字小键盘，超薄性电脑
散热性能：性能也还可以？
外形外观：超薄款
屏幕效果：高清贫
运行速度：比较快"
40,16363864700,2021-09-26 11:15:22,5,"因为之前的笔记本太卡了，开机需要好几分钟，一直想买个新笔记本，在朋友的帮助下，选择了这台笔记本，性价比很高
运行速度：运行速度很快，秒开机，再也不用漫长的等待了
屏幕效果：屏幕显示很清晰，效果很佳
散热性能：散热性能好，用了很长时间，笔记本也不会很热

外形外观：外观很好看
轻薄程度：整体很轻薄"
41,16436759660,2021-10-09 12:22:19,5,首发买的，因为14的重量很符合我的标准，不重，很好用，11系统我很喜欢，操作很流畅，我很喜欢，当天就收到了。买之前问了很多人，适合办公，大家必要入
42,16078570784,2021-08-03 11:40:32,5,"运行速度：非常快，说实话，比之前买的戴尔成就要快很多，固态硬盘，速度上绝不掉链子。
屏幕效果：很不错，比戴尔的那一台屏幕好。
散热性能：没有长时间使用，不过散热还是很不错的，轻度使用，基本感觉不到热
外形外观：轻薄，好看，高颜值，小巧
轻薄程度：还可以
其他特色：尚待发现"
43,16251462964,2021-09-04 20:20:37,5,"还是不错的 我看了差评 非常担心收到次品 
但是收到确实没什么问题  颜值也在线
听歌看电视都挺好的 4399小游戏和植物大战僵尸也玩的溜的一批（总体来说 ?不戳啊??）"
44,16439424897,2021-10-09 22:19:42,5,"屏幕效果：yoga14s同款屏幕，2.8k，90hz，芜湖起飞
外形外观：亮银金属表面，活力满满的感觉
轻薄程度：小新系列，轻薄本一绝，你永远可以相信联想小新
运行速度：最新款英特尔，90多万的跑分"
45,16428228611,2021-10-07 19:16:22,5,这款9.28首发的酷睿版的小新pro14真的太可了，入手不亏，轻薄的十四寸也太适合大学生了，追剧写论文做文档PPT轻松搞定，很小巧，携带很方便。散热效果也挺好的。
46,16483972761,2021-10-19 10:01:27,5,当看到新品首发的时候已经没货了，也没法抢。那就再等等吧，一直关注，每天浏览网页无数次，终于功夫不负有心人，能无货订购了，毫不犹豫订购，第二天晚上半夜到货后上就自动下单了，然后第一时间付款，价格跟首发价一样，哈哈，开心啊。发货很快，收到货后颜值高，日期也很新，激活后试了下，运行很快，智能键盘调光也很不错，激活的时候还说风扇声音大，但是我是没发现，一直很安静！总之，一切都很满意！
47,16419681436,2021-10-06 11:26:07,5,发货速度很快，包装盒完好，拆开机器质感不错，屏幕2.8K非常上档次，清晰度完美，非常满意
48,15870082709,2021-06-25 21:16:12,5,"产品外观设计完美，操作简单，简直太符合我的审美了。
服务态度更是满分?
运行速度：快速
屏幕效果：清晰
轻薄程度：对女生很友好
散热性能：使用后继续反馈目前佳"
49,16439459428,2021-10-09 22:28:26,5,"运行速度：最新11代酷睿处理器，速度方面没问题
屏幕效果：屏幕显示清晰，色域很高
散热性能：散热很棒
外形外观：银灰色上档次
其他特色：做工在可接受范围内"
50,15891390146,2021-06-29 18:50:56,5,"运行速度：很快
外形外观：非常好看，也是喜欢的颜色
轻薄程度：还可以
散热性能：不错，风扇声音不大
屏幕效果：显示效果很好，不玩游戏
其他特色：数字小键盘设计的很好
618的时候精挑细选了好久，才选择入手了这款小新，物流很快，拿到电脑后封装也很好。上手体验不错，不玩游戏。"
51,16420160382,2021-10-06 12:34:56,5,小新pro14整体看来特别小巧，非常方便携带，触控板的面积也比较大。附带的充电器也很小，不是那种大砖头适配器。
52,16444764966,2021-10-10 22:47:41,5,首发很划算，包装很仔细，预定的上午付尾款，下午就到啦，物流超棒，电脑运行声音很小，用各软件也很流畅，首次使用体验满分，做ppt特别舒服，看电影也很舒适，哈哈
53,15889132748,2021-06-29 13:11:52,5,"物流快 第二天就收到了 机器好看 超薄 银色
运行速度：开机非常快
屏幕效果：分辨率高
外形外观：银色 好看
轻薄程度：超薄"
54,15834253537,2021-06-19 16:41:37,5,延续了传统的AIR15的外观.配置得到了全面提升.屏幕显示更好.带背光键盘灯.轻松无忧LOL.优质的音效效果.更真实.棒棒的.
55,16452030813,2021-10-12 18:35:56,5,很久就想买一个笔记本了，对比了多款电脑，还是感觉这款最符合心意。首先颜值真的很强大，就喜欢那种银灰色的，比较商务的那种，这款完美符合。小新pro14的这块屏真的有惊艳到我，文字显示细腻，图片色彩饱满鲜艳。2.8K分辨率，90hz刷新率，然后我很喜欢它的人脸识别，很方便也很便捷，很薄，携带也很方便，非常适合经常出差的人，功能也很强大。人脸识别，感觉很高大上。起初最担心的开机设置也很好的解决了。开机速度也是非常的快的。运行速度也很快。
56,15873461086,2021-06-26 16:31:09,5,笔记本整体外观时尚潮流，轻薄小巧，方便携带，整体配置较为不错，显示屏细节清晰盈亮，对于我学习绰绰有余银色版更显高端大气，全尺寸键盘独树一帜，客服也很耐心解决我的疑问
57,16386977449,2021-09-30 10:28:37,5,"小新15大屏幕，窄边框，如果再配送鼠标，和?背包更好
运行速度：非常流畅
屏幕效果：屏幕细腻，清晰度高
散热性能：散热很好，
外形外观：金属外壳，
轻薄程度：超薄机身，携带方便
其他特色：I5处理器，玩游戏也不卡，带数字小键盘"
58,16556181814,2021-11-02 01:24:03,3,壁纸突然变换是什么问题
59,15829847601,2021-06-18 21:38:56,5,618当天晚上京东送到，开机第一次要插电，充电很快，键盘都没发热，屏幕够大，显示挺好的，搞活动免息3期，先好评了，其他以后再评论～
60,15826853408,2021-06-18 12:49:37,5,送货速度很快，送给老公的礼物，他拿到就迫不及待的打开，特别喜欢。打开的速度也挺快的，现在在装系统，等用一段时间再来评价，这次购物非常满意。
61,16421163139,2021-10-06 15:04:06,5,老电脑作为办公生产力实在不能忍受了，一直想换，研究了好久，一看11320h的小新出了立马以旧换新，一直用联想的机器，体验非常好，尤其这次小新高刷还通过EVO认真，非常符合我打工人的要求，收到货后迫不及待的开箱开机，开机更新这个W11有点久，趁这个间隙发个5星好评，价美物廉的EVO生产力工具到手，顺便还给他买了壳，放包里随便操，哈哈，赞一个！
62,15897124535,2021-06-30 17:40:00,5,"本本小巧轻便，预装了正版office,非常不错。对比了几款还是在入手了这款，是因为觉得这款机器性价比高，家用、学生用不错的选择。"
63,15872839270,2021-06-26 14:34:18,5,小新air14新款锐炬显卡，性价比超高，联想小新系列的模具我一直认为是同等价位中最好的没有之一！百色域加十一代处理器加持，高速硬盘，速度快到没的说！
64,16426204305,2021-10-07 13:22:30,5,好不容易抢到了联想小新14pro，配置好性价比高，2.8K屏幕很细腻很有质感，16G内存 11代I5 运行速度很快，非常满意。
65,16125359865,2021-08-12 20:57:53,5,"刚入手的小新air142021款15-1155G7分享下我的使用感受，首先，整机外观上，第一眼看上去非常漂亮，轻薄，银色的金属机身，触感很好，，14寸全面屏显示非常亮丽，键盘键位的布置很工整，回弹很好，唯一不足的是键盘背光斜着看会漏光，不知道键位下面孔是否是为了散热的缘故，看着很不协调，显得很low，机身背面两条长长的散热孔很惹眼，不知道散热问题是不是windows电脑的通病，这一点我希望能做到像mac那样。第二，性能方面，开机速度很快，就是开机的小新logo就不怎么美观了，显得很幼稚，怎么不用联想的大标，进入桌面后，还是熟悉的win10系统，操作起来行云流水，一点也不卡顿，各项硬件配置中规中矩，鲁大师跑分显示超过全国67%的电脑，这电脑适合学习办公以及运行一些常见的，如英雄联盟和CF等网游，对于大型单机游戏就会有压力了，如果追求性能和完美游戏体验度的同学，可以忽略这款机子，另外，重点说下，系统的语音助手功能很鸡肋,新手手册上面竟然没有把这一功能写进去，搞得我在网上钱了半天的语音助手设置方法都没有成功，这一功能急需改进，人机交互体验不好，也是一大硬伤。第三，上网体验上，毕竟是wih6，和我家的wfh6路由器配合起来，同速杠杠的，下载速度达到48m/s，网页打开速度0.2秒、上网体验极佳，至于游戏速度更不用说了，总体来说，这一款实用型的学习办公本，适合学生和电脑办公人士使用，性价比一般，大品牌，质量和售后都有保障，对于些电脑性能要求不高，简单影音娱乐和学习办公的朋友推荐购买!"
66,15871832624,2021-06-26 10:50:53,5,帮同学买的。联想小新笔记本很漂亮，实物银色金属质感，开机速度快。连接WiFi上网速度流畅，运行了几款常用软件秒开，看视频不卡顿，因为不玩大游戏，我购买的是集成显卡，如果玩游戏的话推荐购买独立显卡。这次购物很满意。
67,16419202156,2021-10-06 10:19:20,5,小新一样美，看的懂的来。重要的事情说三遍：做工精美.做工精美.做工精美。2.8k屏性价比高2.8k屏性价比高质量很好哦，发货也很快，一家非常喜欢的店铺，我要疯狂推荐给朋友们东西很满意哦，美观时尚大气，客服超级有耐心，服务细致贴心，大品牌就是不一样
68,16450912093,2021-10-12 13:46:37,5,电脑已经使用一阵子了，非常轻薄好用，对电脑小白的女生也很友好，买它不亏，性价比超高！我这是自己贴了贴纸之后的效果，裸机也很好看哒
69,16493915231,2021-10-21 09:24:24,5,"从外观上来看本子颜色非常nice ，材质摸起来也很舒服！
用了几天某大师跑分跑了92万分，因为给小侄女用来学习用的，还是非常不错的！
本子的配置，完全能满足日常的办公软件需要，像CAD，photoshop ，Arcgis 等大中型办公软件都能满足使用！
散热性能也挺不错，用一段时间，整体温度基本能维持在35-45度左右。
整体来说，这款机子性能，外观，配置都很nice，同时机子本身重量也不重，小巧挺适合女孩子使用！"
70,16586438547,2021-11-06 14:42:03,5,适合女生的学习办公本，屏幕很清晰，没有独显，不适合玩游戏，轻薄本热量一般，金属质感，银色很高级双十一4699很划算，单手随便拿。
71,16431185975,2021-10-08 10:07:10,5,10月5日付尾款，6日就收到货了，颜色比网上看的更好看，做工也不错，win11系统用起来很流畅，很喜欢这台电脑，给好评！
72,16431169423,2021-10-08 10:01:53,5,运行速度开机速度很快，屏幕分辨率高，高刷新，屏幕看着非常舒服，全面屏，
73,16441816252,2021-10-10 12:08:35,5,挺好的，酷睿版本，用下来，挺安静，本来还担心的，用了一下，挺不错的，性能绝对够用。高分辨率和高刷，感官很细腻。不过不喜欢win11，就把win11改回win10了，用联想管家安装了驱动，有一个pic的驱动没有，最后驱动精灵搞定，原因是联想没有更新到最新版本的驱动，现在完美运行。nice！
