,ID,发表时间,满意度,评论
170,16419911305,2021-10-06 12:00:53,5,运行速度很快，开机巨快，而且我基本上没听到风扇声音，最重要的是颜值好高，并且小巧，重量也不重，适合携带。快递也很快，第二天就到了！
171,16427670538,2021-10-07 17:19:55,5,女生真的很适合用小新，轻薄，性能也很好，性价比很高，特别是这个2021新款。冲鸭
172,15848085281,2021-06-21 22:15:38,5,"运行速度：速度很快，英特尔处理器还是很不错的
屏幕效果：屏幕效果还是很棒的，特别清晰
散热性能：散热性能还可以，用久了微微有点儿热
外形外观：外观是我喜欢的，全金属外观
轻薄程度：特别轻薄，装包里一点儿也不重
其他特色：整体还是比较满意"
173,15850251336,2021-06-22 11:30:50,5,笔记本整体外观时尚潮流，银色更显高端大气，屏幕大本轻薄，方便携带，配置更是没的说，用了两天非常满意，办公软件顺畅里面功能随时都能找到，游戏穿越火线，dota2秒进运行非常流畅，听歌看电影非常惬意，点赞客服有问必答，非常满意的一次购物。
174,15840874388,2021-06-20 18:49:00,5,京东自营就是放心，发货速度杠杠滴，新品，收到后很满意。大小，色彩，整理用机体验都很棒
175,16255669081,2021-09-05 17:28:18,5,感觉还可以，因为不懂电脑，所以就我感觉非常不错，音质也可以，目前没什么不适
176,16552042249,2021-11-01 13:25:21,5,这款笔记本是比较火的，慢一点都买不到，群众的眼睛是雪亮的，高端游戏就整拯救者，办公兼自用就用小新，金属外壳，外形漂亮，手感不错，开机秒开，买给大学生用的，很满意。
177,16423021758,2021-10-06 20:02:26,5,"5号付尾款，6号就收到了，物流很快！
包装很好，打开完好无损，粉色的箱子很漂亮！
开机运行完美，体验很好，详细需要使用后再来评价！
总体五星完美，好评！"
178,15838545837,2021-06-20 12:08:31,5,喜欢联想电脑，小新笔记本是我喜欢的一款。运行速度挺快的，银色外观也很好看，屏幕大。
179,16439003553,2021-10-09 20:35:35,5,快递真的超级喜欢，质量非常好，与卖家描述的一致！?超级好用！还很美观！墙裂推荐！有需要再回购！产品真的超级棒，下次还会买的，愿越做越好，非常好的购物体验终于买到满意的商品了，超出期望，非常喜欢，身边的人都问我要链接性价比高，我很喜欢，下次还会光临物超所值，话不多说，这四个字已经说明了一切
180,15888355315,2021-06-29 10:46:47,5,新款小新air14收到了 最新的英特尔酷睿处理器很强 办公用绰绰有余 屏幕色彩很鲜艳 续航足够长 背着很轻很薄 感觉非常完美 好评了
181,16120797055,2021-08-11 21:40:27,5,一直使用联想笔记本电脑，之前的小Y已经退役，现在的小新替代。这款笔记本特别轻巧，运行速度很快，但音质效果对比Y系列要逊色很多。后面多使用一段时间再来补评，比较客观。最后给京东快递点个赞了～快！
182,16059746775,2021-07-30 14:32:03,5,语音指示操作完美，还有新手手册都福袋视频！也太棒了！非常方便，实现自己装机，自带office和wps，完美啊！！！非常流畅，摄像头还可以手动关掉，摄像头也很清晰，提示开机风扇声音很大，其实没什么声音，散热也很好，一点都不烫！
183,16421332380,2021-10-06 15:30:38,5,5号早上付款，6号中午就到了。发货速度真快！第一次使用联想电脑，还没激活，期待以后的使用效果！
184,16425319483,2021-10-07 10:14:14,5,电脑很轻薄颜色也很好看，键盘用起来手感很好，画质也很清晰，充电器是小巧的快充，充电时间很快，最重要的是不怎么发热，运行和开机速度也很不错，上网上课办公都很棒的一款电脑！！！
185,16471293613,2021-10-16 16:19:22,5,"运行速度：非常快，内存条频率到4000Mhz多。固态盘加持更加迅速。
屏幕效果：屏幕真的太棒了，非常棒的显示效果！不仅2.8k还是90高刷新率。
外形外观：银色金属机身非常好看
轻薄程度：1.5kg左右应该是总之不重
其他特色：我感觉真的是5000左右性价比最高的办公本"
186,16437548913,2021-10-09 15:19:24,5,预装了系统，银色也很好看，充电器是白色的，外包装也很严实，总体上来讲，非常不错，买来用作办公电脑的，重量我还可以接受，出差也没问题，就是要买个包包
187,16425464029,2021-10-07 10:45:17,5,运行速度：屏幕非常的清楚，开机速度快，人脸识别解锁方便，音效很好，京东的速度非常快，第二天就到手了，软件运行流畅，一直用联想的电脑，做工优秀！
188,16567195113,2021-11-03 16:03:56,5,"散热性能：轻薄本，我一般看个视频，做个文档，一般感觉不到电脑太热，效果不错的
外形外观：外观很好，设计的很全面，键盘背光
其他特色：京东快递就是快，一两天就收到了"
189,15856513833,2021-06-23 11:47:01,5,"运行速度：办公玩游戏都没问题 速度很快
屏幕效果：显示效果可以 没事周六周末还可以在家追剧
散热性能：散热还算不错的 夏天用的话也OK
外形外观：外观设计非常好看
轻薄程度：很轻 上下班带着也不累"
190,16246312981,2021-09-03 21:22:28,5,哇 太优秀了 超级棒 外观漂亮 运行速度很快 打游戏非常流畅 你值得拥有
191,15867680091,2021-06-25 12:46:52,5,"运行速度：很快  办公没问题
屏幕效果：很清晰   作图没问题
散热性能：散热很好
外形外观：超级漂亮很喜欢"
192,16628341995,2021-11-12 16:48:15,5,电脑很好啊，开机秒开，打开软件一下就打开了，屏幕显示的还很好，高色域的屏幕，看起来很好，效果不错，看电视的时候，办公的时候也很方便
193,16540355214,2021-10-30 09:55:38,5,特别的轻薄，性能稳定，特别适合学生党上班族等人群使用，联想大品牌值得信赖，还在犹豫的朋友们抓紧时间入手，性价比超高，值得拥有
194,15858110545,2021-06-23 16:24:19,5,女朋友想要这款本很久了，今天终于到手了，果然外观给人眼前一亮的感觉，玩了几天，开机速度，软件运行速度都不错，玩英雄联盟也是毫无压力，好评。
195,16558738116,2021-11-02 12:23:21,5,"运行速度：速度非常快，玩游戏办公都不卡
屏幕效果：色彩明亮，细腻鲜艳不伤眼
散热性能：散热快，时间长也不发烫。
外形外观：工艺美学设计，时尚简洁
轻薄程度：体积轻，携带方便防灾包里不占地方"
196,16506614364,2021-10-23 16:15:57,5,"运行速度：目前为止非常快
屏幕效果：画面感超级棒
外形外观：非常漂亮，键盘爱了
散热性能：散热非常好，办公用妥妥的"
197,15875504968,2021-06-26 23:59:12,5,新买的小新笔记本电脑很快就到手了，已经使用了一段时间，感觉非常好，手感很不错，运行速度极快，不管是日常办公还是娱乐都很好，不错不错
198,15893194049,2021-06-30 00:30:10,5,快递速度很快，很好的购物体验，笔记本比想象中的要轻要薄，用来办公性能足够用很方便携带，高色域的屏幕加上i5十一代处理器16G存储512G固态硬盘性能还有显示效果都很优秀，三挡模式切换游戏办公二不误很贴心实用的设计，期待使用过程中更多的小惊喜，很满意的购物，赞！！！
199,16441258815,2021-10-10 10:27:02,5,"散热性能：很好，这套模具散热绝对
外形外观：金属外壳，
轻薄程度：轻薄本果然不错
运行速度：EVO认证果然厉害"
