,ID,发表时间,满意度,评论
157,16392604916,2021-10-01 09:37:21,5,"包装保护：非常完整，买回来没有任何挂损
外形外观：非常具有机械风
游戏效果：非常流畅，可以同时运载多个游戏
运行速度：运行速度堪比光速，是打游戏首选"
158,16520590304,2021-10-26 12:04:02,5,宝贝收到了，快递很快昨天下的单第二天就到了不到一天，屏幕很清晰颜色也很好看没有色差，键盘啥的摁的都挺舒服，总体感觉很棒
159,15830042917,2021-06-18 22:08:49,5,"包装保护：三个箱子，一个大箱子，保护箱子，最里面电脑箱子，再里面泡沫包装非常安全！
外形外观：看图片，我不会拍照，但是依然掩盖不住雷神独有的霸气科技外观，这是其他品牌没办法比的！
画面品质：画质没的说，一流！
跑分评测：一百二十万可还行？
运行速度：跑分足以说明一切，没问题??
游戏效果：正在下载GTA5，这配着跑分肯定没问题，下载好了再给追评。
另外雷神的音质也真的是一级棒！还有就是雷神的性价比，真的良心！"
160,16578378202,2021-11-05 08:57:53,5,收到包裹后 ，包装的非常好很严实，刚刚打开就满满的科技感全程语音指导 ，让你不会有一丝迷茫 ，而搭配上雷神鼠标 非常有气质 ，摆在那里都是一种享受 ，非常建议入手一款 。
161,16434611533,2021-10-08 23:12:10,5,"包装保护：包装可以的
外形外观：霸气高端大气上档次
画面品质：流畅高清 玩游戏无压力
跑分评测：可以的
运行速度：速度特别快"
162,16512059275,2021-10-24 17:17:27,5,"迫不及待的打开，非常满意，外观非常大气，运行方面不错快，
画面品质：清晰
外形外观：大气
包装保护：完好
运行速度：非常不错
游戏效果：快"
163,16437831298,2021-10-09 16:12:55,5,第一次买雷神笔记本，不过关注很久了，屏幕很大，体验值夜很不错，给自己买的，很满意
164,16558051150,2021-11-02 10:38:23,5,"外观大气，可放公司办公用，屏幕17.3很大了。办。公看文件很轻松，不用像以前一样，趴电脑上看了。
反应很快，电脑没有任何自带软件，非常干净。
键盘手感很好，led和背光很有高级感。
这电脑玩3A大作效果直接拉满，买来主要是玩Steam的。 终于可以完美体验游戏的精彩了。
本虽然是游戏本，但是并不厚重，非常轻薄，和之前的air差不多。
好了，玩去了。等去加装个1T固态就完美了。"
165,16190882002,2021-08-25 13:37:08,5,收到打开很惊艳，造型好看，对于游戏本来说已经算轻薄了，对比朋友的游戏本来说。以为觉得信仰灯的灯光好好看，开机测试中。很满意。就是第一次开机为什么要接电源?
166,16009602161,2021-07-19 21:27:44,5,女孩子对电脑各方面啥的都不懂，所以请教了大学同学，他就给我推荐了这款游戏本，说是打游戏的笔记本用来办公贼6，画图什么的都不会卡，别的电脑画图久了就卡的用不了。并且与同价位的电脑相比，这款真的性价比贼高，拿到手感觉真的很好，无论是手感，速度等各方面，爱了爱了，推荐大家买这款游戏本，真的性价比很高。
167,16551560305,2021-11-01 11:57:41,5,第一次购买雷神的笔记本，非常不错，感觉捡了个便宜。开机速度很快，运行很快，不错不错，物流速度也很快，客服态度很好，很耐心的给我讲解电脑的一些问题。???。
168,15923004048,2021-07-04 12:24:14,5,"15年6月买过G150P，现在还在用，个头大的像个移动工作站，适合放在固定的地方使用，但扩展性极强，性价比非常高。
这次是我第二次买雷神了，前天晚上下单，昨天到货、试机，速度确实快。外观大气，科技感很足。整体大小、重量刚刚好。各项参数很好，能满足需要。
随机内存是两条8G DDR4 3200的内存条.由于我需要运行多个虚拟机，所以计划更换成两条16G的，加配一个1T的Evo固态硬盘（随箱赠了磁盘固定架及备用螺钉）。
这个本儿的性价比很高，推荐。"
169,15841261472,2021-06-20 19:56:52,5,"包装保护：比较严实，收到时没有任何损坏
外形外观：很酷炫！纯黑外表，雷神标识
运行速度：较快！特别是开机速度挺快的，毕竟新电脑干什么都不卡～
另外提一嘴：发货过来挺快的！！！18号下单20号早上就到了，应该说不愧是坐飞机过来的电脑吗哈哈哈"
170,16332069457,2021-09-20 08:34:16,5,"包装保护：太好了，包了三层里面还放的泡沫填充感觉非常棒
外形外观：科技感满满还有背光键盘，简直太帅了，

中午送到，物流没得说！ 开机速度非常快，测评跑分时候的满载风扇声音不错，相当可以！整体性能效果突出啊！太喜欢了！11代i5，3060简直没得说，玩游戏cf，lol画质非常流畅，棒！"
171,16607498665,2021-11-09 18:47:25,5,这是我花了好长时间，从很多机型当中优先选出来的比较具有性价比的一款机型。他的配置已经达到了行业顶尖的配置。他处理器加上硬盘，加上内存，加到各方面的配置。晚上已经达到了游戏本的行业顶尖水平。我也是差不多的水平，并且配性价比配置特别高。在过去的这段时间内，跟客服打了非常多的交道，因为关于订单改地址的问题，联系了很多次，客服耐心的帮我解决了，最终更换订单，重新下单。其他的问题也帮我一并予以解决。必须给商家和客服点个赞，非常满意。其实想一想到这个价位能选的空间就那么几台，要么选外星人，要么选华硕的玩家国度。对吧，要么选其他的。但是一定要体现个性，那我觉得大黄蜂的这个黄色非常鲜艳夺目，也体现个性特点。
172,15805269066,2021-06-14 13:24:46,5,之前一批活动没抢到，这次终于到手了，最新11代11800处理器+3070满血显卡。性价比超高的产品。 外观炫酷，键盘手感舒适。高色域+2.5K屏幕看着非常舒服。
173,16608389550,2021-11-09 21:05:14,5,完美，包装很严实，没有磕碰。颜值很高。键盘灯很漂亮。居然自带正版win11！第一次开机需要等待系统初始化完成，重启之后开机非常快。很满意！雷神，YYDS！
174,16555139871,2021-11-01 21:17:48,5,牛批，跑分一百多万，运行极度流畅，机身炫酷无比，满满科技感。期待打游戏的表现。满意
175,16119122263,2021-08-11 15:18:27,5,一直都是用的雷神，用了几天才来评价首先细节做工都很好，颜值没得说，玩游戏流程的一批
176,16535639598,2021-10-29 11:23:54,5,"感觉好高端。超级大气。
玩起来也是速度快快的
很满意。
雷神各种款式的感觉都好科幻。
很满意的一次购物"
177,16426681048,2021-10-07 14:39:37,5,电脑是1号下单的，3号到的，快递速度还是很快的。电脑包装完整，无破损。i7的处理器，开机速度，运行速度特别不错。屏幕15.6寸的很适合玩游戏，看电影。用了一下午，电脑稍微有点发烫，可以接受的范围。外观特别棒。对于价格来说，物超所值。
178,16138950523,2021-08-15 14:15:43,5,给孩子更新换代 综合评价找到咱们的产品，包装好，配送一流。孩子体验后来评价一下，主流玩的3A大作 FPS游戏都最高画质毫无压力 配合SSD开启光影追踪 体验一流 ，值得推荐！
179,16060037734,2021-07-30 15:48:17,5,"拯救者，飞行堡垒，游匣中脱引而出的911air星战四代
综合对比，性价比超高，5000档的不二选择
资深的电子产品手机电脑销售者，亲选jd此款
赠予外甥，满足大学期间的学习和游戏娱乐
希望后续的雷神品牌在配件上能跟上，包鼠等"
180,16561953831,2021-11-02 20:26:17,5,第一次用，开机很快，自己不太懂电脑，客服也比较细心，慢慢的给我交教，电脑现在用起来很好！
181,15974345007,2021-07-12 19:39:15,5,"颜值非常高，大大的赞，设置系统有点麻烦，客服到是很耐心的讲解！
外形外观：没得说
包装保护：很好"
182,16165098236,2021-08-19 23:51:11,5,物流很快，朋友推荐的收到货很惊喜，很喜欢。电脑不错，运行速度快，无卡顿，货比三家才决定下手的。客服很好！服务态度好！
183,16598255316,2021-11-08 11:31:30,5,京东快递挺好的，小哥很快很负责，外包装完好，没有破损，机器质感不错，第一次买游戏本，希望这个产品能物有所值
184,15860432233,2021-06-23 23:51:01,5,超级喜欢雷神这个系列，颜值性能都很棒，运行速度快操作舒适键盘非常有手感，非常好的游戏本，高配置，高性能，喜欢，一直支持。
185,16037697825,2021-07-25 14:46:37,5,"首先，东西送过来的时候非常精致，保护层有几层，不像拆开过的样子。目前收到货十天了，电脑反应很快，开机十秒不到。11代处理器，3050,才要5000,现在一个轻薄本都不止这个价格。外观，也很好看。不亏！"
186,16038863870,2021-07-25 19:05:21,5,"太帅了，超级赞，建议大家购买，反应很快一点也不卡，还得是雷神！！！
外形外观：这颜值简直没谁了，太酷了，游戏神机！！很划算? 爱了爱了～"
187,15857493852,2021-06-23 14:39:27,5,非常非常非常非常的帅气啊啊啊啊爱了爱了，期待好久了，配置非常高，评测也好高分，一直看好雷神，现在终于下手买了，大家赶紧冲啊，不要犹豫！
188,16599049737,2021-11-08 13:34:39,5,"运行速度：特别流畅，一点也不卡顿
包装保护：包装特别好，产品无损坏
外形外观：LED灯很霸气，很喜欢这个设计
游戏效果：速度很快，十分流畅，玩什么游戏差不多都可以"
189,15837367934,2021-06-20 08:30:56,5,"包装保护：保护的很好，一层里面还有一层。
外形外观：大气，上档次，摸在手上很舒服很光滑。
画面品质：这画质真的没得说。完美。
游戏效果：运行特别的流畅，一点都不卡。
运行速度：开机玩游戏速度很快很快。"
190,16619954896,2021-11-11 15:42:11,5,第一次买没有失望！外观结实好看，键盘白光，一起买了散热器和鼠标，用起来感觉非常好，散热好，性能好，速度快，售后好，买它买它！
191,16574435822,2021-11-04 16:47:55,5,很不错，运行不错，也不卡，我本人是一个不太远游戏的人，用起来非常顺手，很好的笔记本，手感颜值全在线，氛围灯很好看，商家也很有礼貌
192,16188404094,2021-08-24 20:55:22,5,"包装保护：采用三层纸箱包裹，内部蓬松防摔塑料块保护电脑不受磕碰
外形外观：外观帅气霸气，十分有科技感
运行速度：插了电之后非常流畅，gtav流畅运行
游戏效果：非常流畅，只不过玩游戏声音特别大，也特别烫"
193,16339661339,2021-09-21 12:49:50,5,网上看了一个月了，最后决定买雷神笔记本，里外三层包装，外观超酷炫，玩游戏，听音乐，看电影，非屏幕非常清晰，很满意
194,16396938274,2021-10-01 23:39:44,5,"包装保护：无敌了简直三层包装看不到缺点

外形外观：线条符合我的审美
画面品质：高清无茶饮
跑分评测：游戏本绝了"
195,16024383309,2021-07-22 10:11:27,5,"精挑细选最终选择了雷神911系列，轻薄好用颜值爆表。
自带背光键盘，性能处理器10分优秀，运行CF完全无卡顿秒进秒出。而且性价比优秀，屏幕的质感很好。
雷神雷神，就你最神，点赞！"
196,16577472004,2021-11-04 23:20:54,5,"包装保护：四层保护

外形外观：炫酷
画面品质：清晰流畅

运行速度：很快
游戏效果：很好
电脑很好，这个配置相较来说很便宜了"
197,16606705305,2021-11-09 16:46:20,5,第一次买这么好的笔记本，晒个单，客服说送个包，谢谢了！这边还在体验中，后期还会追评的！感觉高大上呢！！
198,16273168135,2021-09-08 22:41:29,5,笔记本散热非常好。颜色非常醒目。工艺比xx革命好多了。设计出风位非常好。非常建议购买，三星全家桶，爽到没朋友，只有游戏就够了。跟我的松下空气净化器简直就是完美搭配。老马散热器鳄鱼省了。
199,16122233800,2021-08-12 09:55:35,5,笔记本很帅，也没有评论里说的漏光开不了机等等问题，快递也很快，大早上就给送过来了，第一时间拆开了，咨询客服分盘客服也很给力。赞赞赞赞赞
