,ID,发表时间,满意度,评论
0,16186088501,2021-08-24 11:34:40,5,"运行速度：超极本的速度还是不错的，办公目前完全够用，买这个机器就没有想过打游戏，据说这个机器是可以玩穿越火线和lol的。音质很好，这是我没有想到的。我之前的大机器神州战神笔记本K650D和这个比较起来完全听不得
屏幕效果：屏幕效果在我看来也很不错，虽然是低色域屏幕，如果你不去对比看的话，根本看不出来吧，对比下台式机的屏幕，没什么区别
散热性能：散热性能感觉很一般，如果软件开很多，温度很容易上来，昨天更新了系统，感觉没那么严重了
外形外观：非常nice,很好看，超级喜欢，这个设计就是喜欢
轻薄程度：很轻薄，重量控制得很好，之前的笔记本傻大黑粗
其他特色：竟然可以和手机联通，同屏，传输文件，播放手机音乐，调用手机应用，摄像头等，功能很全。在电脑端同屏操作有点点卡顿感，希望以后可以优化，手机端就不卡！自带的壁纸黄色的，难看，不如夸父壁纸，鲁大师跑分23-25万之间。总之，这是一个很好的机器"
1,16390303304,2021-09-30 22:32:38,5,"??开机速度：开机速度挺快哦 我数了一下才9秒
??产品外观：外观很简约耐看 我和我同学们的对比了一下这款真的挺漂亮了
??性能：轻薄本打打cflol挺不错了 lol高画质有稳定的140fps 性能足够用了
这笔记本性价比也挺高哈 我千挑万选才选到这么中意的电脑 现在用了几天了 很流畅 ！买电脑就该来自营店买！"
2,16371831205,2021-09-27 15:18:48,5,首先是电脑很轻薄，1.4kg，绝对是便携式办公电脑的首选，实物外观比京东页面上的展示图要好看很多，使用的AMD  R7  4700U的处理器，16+512（固态硬盘）的存储搭配，跑分57万多，性能在办公本里已经很突出了，运行速度很快，温控表现很优异，日常使用基本上感觉不到发热，如果加上指纹功能和NFC闪传功能就更完美了，总体来说还是非常值得推荐的。
3,15845892309,2021-06-21 15:59:18,5,开机流畅，运行速度快，一点不卡，屏幕尺寸合理清晰，材质手感细腻舒适，用于办公非常棒，14寸的笔记本超薄，小巧，方便携带，外观漂亮！你值得拥有！
4,16561727246,2021-11-02 19:56:19,5,华硕大品牌值得信赖，本本安全到家，没有丝毫刮伤。开机快，下载软件速度也是非常的迅速。屏幕清晰，底部两个小时也没有烫手的感觉。按键灵敏，外观非常时尚，轻薄是一大亮点。
5,16443858514,2021-10-10 19:14:50,5,对比了好几款最终了选择了这款，一点都没有选错，本本很精致，大小正好，很轻方便携带，重要的是开机速度很快，分辨率也很高，音质也不错，很赞值得购买！
6,16614624031,2021-11-10 21:12:37,5,趁活动换的电脑，运行非常流畅，键盘打字手感不错，也很轻薄，方便随身携带，非常适合学生党，性价比高，基本办公一把子搞定，特别适合人文社科类学生
7,14854202184,2020-11-06 21:00:20,5,"运行速度：速度非常快，开机和关机速度秒杀我之前所有电脑，开机和关机速度用不上两秒，运行程序速度快
屏幕效果：屏幕看着清晰，效果好
外形外观：外观漂亮，轻薄，高级
轻薄程度：看图片就知道有多薄了，薄的非常完美
散热性能：连续用了好几个小时，基本感觉不到发热
其他特色：接口丰富，能满足办公的一切要求，完美"
8,14938853319,2020-11-20 23:06:35,5,电脑外表简单大方，银色看着赏心悦目，机身轻薄便于携带，使用起来很流畅，不卡顿，下载软件也很方便，电脑充电器小巧轻便，方便携带，且充电速度快，待机时间长！
9,15994521248,2021-07-16 21:16:54,5,"运行速度：挺快的，开机神速。
屏幕效果：看电影效果不错，美滋滋，加上音效简直太棒了。
散热性能：下载比较多软件的时候有些热，其他还不错。
轻薄程度：轻，颜值又高
买到这样的机器真是性价比太高了，真棒?"
10,16234787514,2021-09-01 16:51:24,5,第一次买笔记本，外观很漂亮，手感也很好，关键质量值得保障，都是新机，未拆封的
11,15847438303,2021-06-21 20:23:05,5,很薄很轻，电池内置，显示效果也不错，平时工作，CAD和文档处理绰绰有余，不适合玩大容量游戏，是工作本，开机速度很快啊！
12,16555986492,2021-11-01 23:47:42,5,"运行速度：2～4.1hz很迅速。八核八线程，处理的很得当。
轻薄程度：我的老笔记本是10年前的华硕，一对比老电脑是很沉重，充电器也小巧，很方便。不像以前老电脑一大个充电器。
品质不错i5二代处理不动了才换新，用了十年我没修过，拆开三次都是清理灰尘。
屏幕效果：屏幕色差不错，全高清也不差，"
13,16593252015,2021-11-07 16:24:33,5,宝贝收到啦，实物真的好看，价格非常实惠，强烈推荐这款，超级喜欢非常值得信赖的品牌，质量有保障，价格还亲民，相当满意大无语事件家人们！咱就是说，太好用了，狠狠的爱住了！质量很过关，品质有保障，相当不错的选择，好多朋友看我用都想买，我都推荐了一次很好的购物体验，服务周到，物流快速，配送也很周到，态度也很好，好评！物超所值，商品设计完美，外观也很高大上，让人爱不释手。客服更是热情的没话说，这次购物很满意
14,16404724303,2021-10-03 13:14:20,5,"挺好的我觉得小巧方便 而且还轻便
运行速度：很快 不会卡顿
屏幕效果：比较清楚，可以接受
散热性能：散热器声音较大
外形外观：外观很上档次，银灰色的，非常好看而且耐看。"
15,16591099474,2021-11-07 11:01:44,5,"运行速度：第一次使用华硕AMD处理器，运行速度在轻薄本里还是能达到预期的。
屏幕效果：屏幕清晰，分辨率高。
散热性能：散热良好。
外形外观：轻薄本，比起原来的游戏本轻了好多。
其他特色：3个USB，1个tipc接口，非常实用。"
16,14740881133,2020-10-11 15:13:26,5,"运行速度：办公用 学生用足够
屏幕效果：可以接受
散热性能：不错，搭载7** amd处理器 散热非常好 没有出现起热。
外形外观：非常好看，超窄边框，银色 。
轻薄程度：超薄款式。"
17,16377118308,2021-09-28 15:56:36,5,电脑收到了，包装完好，打开咋一看颜值非常好，仔细一看，机器很轻薄，很时尚，京东快递速度也很快的！一直想买一款轻薄点配置也不错的机子，收到货简直太喜欢了，太好看了，屏占比也很好，硬盘够大，散热也挺好，达到理想效果，非常喜欢！！！
18,15377024622,2021-03-03 19:51:48,3,"比较卡顿
运行速度：一般般"
19,16121175811,2021-08-11 22:59:35,5,"很多年没换电脑了，强行把小Y退休了。
京东真是牛掰，第二天就到了，拿到手迫不及待就开箱。全金属机身，摸上去非常有质感，做工比几年前的优秀很多。接口还挺多的，日常办公不用扩展了。屏幕屏占比很高，同是14寸比之前电脑瘦了一圈。开机速度是真快，第一次开机需要自动安装系统，全自动完成，不懂电脑的人都可以搞定。屏幕很清晰，没有颗粒感，观感很舒适，不辣眼睛。整机运行很流畅，办公效率是真的快了很多。喇叭音质还行，对音乐要求高的还是得接音响。平时不玩游戏，感受不是很清楚。"
20,16242327125,2021-09-03 05:20:05,5,性价比很高的本本，买来就是用来移动办公的，很轻巧、很便携。@速度很快，屏幕没有发现像一些人的评论的那种现象。哈曼卡顿的音质也特别出众！这个价格能买到这样的笔记本还是很超值的。
21,16378791448,2021-09-28 21:51:02,5,这个华硕笔记本真的很不错！外观秀气，轻薄机身，机器屏幕效果也很好，AMD性价比超高！办公用妥妥的！机器运行速度很快，上网及office办公神器，而且这个机器的音质很好，真诚推荐款哦！
22,16437829601,2021-10-09 16:14:02,5,首先外观简约大气，到手感觉很轻薄，1.4kg非常适合女生用。锐龙r7系统加上512G大内存，对于要学编程的我来说非常好用，充电之后大概可以用6－8个小时，日常使用不开太多软件的话散热也不错，就是屏幕确实可以升个级了。总体来说非常不错！
23,15733019787,2021-05-29 15:45:08,5,"电脑着急用 正好看到有活动  凌晨拍下 下午就到了我们小县城  京东快递  超预想  神速  大赞
颜值高 超薄 银灰 科技感十足  也是因为灰色有活动所以选择灰色  但是到手发现真的很好看  
办公用 性能足够   秒速开机  5秒左右开机 没有下载游戏 不知道游戏体验如何"
24,15616795561,2021-04-29 20:41:40,5,很满意的一次购物，开机速度杠杠的，很不错，电脑质感也很好，很适合我。尺寸也合适。
25,16404597327,2021-10-03 12:43:24,5,这电脑是我今年买的第二台了。给女生用，十分合适。电脑非常漂亮，做工精细，颜值担当，非常方便，?喜欢的朋友可以下手！
26,15960635908,2021-07-10 16:55:39,5,"快递包装虽简约，物流速度没的黑。
轻薄透气重量轻，价格美丽吸引人。
数码产品不精通，想买更贵需打工。
时尚办公易携带，优质性能人人爱。
小巧便捷充电快，银白质感真不赖。
系统流畅、画质明亮、音效动听，愉悦人心。
焦急等待为秒杀，京东快递次日达。
键盘敲击真是爽，精致低调不张狂。
如今快递已签收，整活评论诗一首。
电脑我是真喜欢，兄弟别骂我舔狗。"
27,16522814641,2021-10-26 18:49:26,5,对于电脑小白的我来说，这款笔记本完全没问题的，电脑很轻薄，开机速度很快，不卡顿，运行很流畅，然后其他的一些东西我也不懂，但是对于我来说还是很满意的一台电脑??
28,15759249225,2021-06-04 12:55:27,5,机器收到了，包装很好，机器很轻薄，很时尚，京东快递速度也很快的！一直想买一款轻薄点配置也不错的机子，收到货简直太喜欢了，太好看了，屏占比也很好，硬盘够大，散热也挺好，达到理想效果
29,16608637651,2021-11-09 21:34:51,5,头一次买华硕的笔记本，外观小巧，运行速度快，开机只需几秒，很轻薄，适合女生用！非常不错，喜欢?
30,15385295910,2021-03-05 20:14:39,5,总体来说性价比很高，首先从开机来说非常快，再者从外观来说很小巧便携，颜值非常高，屏幕很清晰，运行速度也相当的快，非常喜欢，很满意的一次购物，同事看了也都说很好看。
31,16107154091,2021-08-08 16:44:01,5,电脑很轻巧方便，充电器也很小很方便携带。电脑音质特别好运行和开关机速度也很快，一般大学生足够用了。屏幕显示也很细腻!好评！
32,15356680695,2021-02-26 20:49:11,5,运行速度特别快，一点也不卡顿，里边功能也很好，开机就有小助手全程指导注册登陆，外观也很时尚，键盘超级好用非常的灵敏，而且颜值高，轻薄本，它是轻盈设计千宝机身，非常的喜欢。
33,16106997595,2021-08-08 16:04:36,5,电脑外观很秀气，典型的轻薄本。开机不到10秒，系统反应速度也很快。作为办公用足够了。相信华硕的品质与做工。大赞京东快递的高效，昨天下今天到，爱了爱了！
34,15843280600,2021-06-21 08:21:28,5,整体机型简单大方，个人很喜欢。产品轻薄方便携带，运行速度快，散热性能好，开一上午电脑也不是很热。续航时间长。非常推荐学生党拥有！
35,16107113358,2021-08-08 16:32:57,5,朋友让我帮他推荐一款笔记本电脑，第一时间就想到了华硕这个品牌。华硕a豆Redolbook14 锐龙版，性能，颜值都能够满足他的需要，16g内存512存储，办公学习，打开网页都非常快。看来是选对了。
36,14832920348,2020-11-02 22:42:24,5,一直购买华硕笔记本电脑，这款redolbook14锐龙版笔记本性价比高，有16g内存，运行速度很快，屏幕色彩可以，散热正常，银色的外观，很轻薄，方便携带，音质也可以，办公学习很棒，双十一买到的价格很值
37,15397927798,2021-03-08 23:34:48,5,物流给力，包装完整，东西不错，已经用上。14寸的轻而小巧，进系统很快，序列号对的上。华硕笔记本果然给力啊！
38,15062524691,2020-12-18 09:36:20,3,电脑还行吧刚买第二天就卡死了一下
39,15960014724,2021-07-10 14:52:20,5,本本外观非常漂亮，银色看着很舒服。机器也很轻薄，方便携带。开机运行非常流畅，屏幕显示效果很清晰，色彩很柔和。非常满意的一次购物。
40,16253742478,2021-09-05 10:36:30,5,金属摸起来超舒服的，果然轻薄本就是不一样啊！ 而且锐龙CPU真的性价比比英特尔高很多喔！ 我16+512这个配置是刚刚好差1块钱到4K入手的哈哈哈，推荐同学下单的，同学很喜欢！流畅自然不用说了！这个配置还卡是不可能的啦，打大部分网游都是OK的！做设计也是OK的！
41,16618272750,2021-11-11 11:56:44,5,"运行速度：新电脑速度还可以，办公足够用了。
屏幕效果：分辨率还差不多，可以的。
散热性能：满足使用需求。
外形外观：很薄，也很小巧，颜值不错的！
轻薄程度：轻薄笔记本，方便携带。"
42,16631004809,2021-11-12 22:37:31,5,很干净好看的外形，小白用也挺顺手的，音质真的不错，整体挺喜欢的。
43,16622107444,2021-11-11 19:58:43,5,"运行速度：很快的
散热性能：也不错的
外形外观：四四方方的
轻薄程度：还可以，不是很重
开机只要三秒，爱了爱了！！！"
44,14900986497,2020-11-14 15:31:44,5,"运行速度：超级快哦，开机很快，运行也很快，速度真的超级快的
屏幕效果：很清晰，而且到时候很干净，整个电脑很干净
散热性能：用了很久也不会有多烫，散热性能非常不错，比我以前买的贵的还好
外形外观：非常好看，很轻薄，很小巧精致，很方便，很适合外出携带
轻薄程度：很轻薄可爱，小巧玲珑简直没有瑕疵
其他特色：键盘很干净，触摸鼠标灵敏度很高，出门携带很方便，这个价格能买到真的很好，客服服务态度非常不错，物流相当快，用白卡付款还不用现金，真的很值得大家入手啊！！买到就是赚到！！！！"
45,15823844988,2021-06-17 22:32:27,5,"运行速度杠杠的，办公，网游足够用了。屏幕效果很好，眼睛很舒服。外面设计简洁大气，是我喜欢的风格。散热效果还不错，用了半天，摸上去还好，可以接受。另外此款笔记本很轻薄，出差必备款！
让我忍不住夸赞一下京东快递，昨天18点下单，今天上午就收到了，京东铁粉"
46,14761458901,2020-10-16 21:29:11,5,"运行速度：速度非常给力
屏幕效果：色彩很舒服，很喜欢
散热性能：散热很好
外形外观：银色漂亮
轻薄程度：很薄很轻
对比很多机型，这款是性价比很高的选择，音质也非常好，屏幕色彩很舒服，薄轻，携带方便，华硕耐用，之前就买过其他型号，值得信赖的品牌"
47,16148703275,2021-08-17 08:50:17,5,电脑性价比很高，快递速度很快，隔天即送到！机器外观很轻薄，银色看起来很养眼，机器反应速度快，作为办公本确实不错！相信华硕的品质，相信amd的性能，不错不错！这是第三次购买华硕本了！！！
48,16447893500,2021-10-11 18:24:12,5,**上大学大二了   需要用到笔记本    电子类产品当然首选京东    挑了好久终于在京东自营店选了这款    首先这款笔记本轻薄  重量轻  携带方便  其次处理器  显示器都出类拔萃  远超自己的预期   价位也很有性价比   **说这款笔记本颜值高操作流畅  电池续航久    很满意！
49,16594807833,2021-11-07 19:48:03,5,"我觉得挺好的
大学团支书，日常办公，不打游戏
完全够用了
也很轻便，好携带
也特别好看
性价比很高了
希望能用四年??"
50,16574557137,2021-11-04 17:02:03,5,外观好看，较为轻薄，很适合学生党，键盘灵活，开合容易，不卡屏黑屏。客服态度很好！物流超级快，一天就到了。
51,16286759726,2021-09-11 12:40:24,5,"总体上还可以  轻薄方便  设计简单大方  如果能配个电脑包就更好了   这款总体上性价比很好  固态硬塞 cpu配置也可以  如果就是办公用  完全够了
散热性能：不错
屏幕效果：也是色彩不错  对于这个价位
运行速度：也很好"
52,16292200228,2021-09-12 14:03:13,5,价格很实惠，非常好，挺薄的，手感不错，???????，性价比很高，会介绍给别人，也很好看，不错不错，打售后教我分了3个区，
53,16367868574,2021-09-26 21:32:59,5,外观很好看，体型也很轻，性价比高，打开电脑用起来流畅性很好，虽然是第一次买华硕笔记本，但是买对了，很喜欢，平时用来处理一些简单的办公完全很可以，喜欢赶紧下单吧！
54,16615116380,2021-11-10 22:12:51,5,电脑性价比很高，运行速度非常快，各种应用跑起来非常流利。一般的办工，开发，都可以满足需求，妥妥的性价比之王啊。
55,15754088368,2021-06-03 12:32:43,5,运行速度特别快，用起来一点卡顿的感觉都没有。用了一段时间后才来评论的，外观非常漂亮很轻薄，声音几乎听不到，数字键盘用起来也非常舒服?强烈推荐食用
56,16078845292,2021-08-03 12:29:03,5,"太好康啦！！！！
14寸的，而且比较轻巧 jio得特别适合办公的女生
性价比很高，这配置我是完全够用了 运行速度也很快
刷刷剧啥的也很爽
预算不太多的集美 用来办公 真可以冲啦"
57,16202757846,2021-08-26 22:37:58,5,"还可以，看着很轻便，手感也不错。刚刚入手，希望好用哟～
银色看着挺高端，电脑也很只能，可以语音了。"
58,16282543368,2021-09-10 18:56:08,5,收到货了，非常好，开机速度快，下载东西也很好，支持语音下载。物流也很给力，隔天到货。
59,15519351464,2021-04-10 12:55:34,3,还行吧，用了一段时间，有点卡了
60,16466330812,2021-10-15 17:17:21,5,电脑非常好用，处理器用的R7，性价比高，性能强，适合打游戏的轻薄本，价格相当厚道，屏幕素质是2k的，很清��，看视频非常舒服，可以说非常棒了。
61,16280772522,2021-09-10 12:45:16,5,系统很流畅，基本上没有声音，很轻很薄，带着很方便，续航能力强，屏幕看着很清晰，手感很好。推荐入
62,16241597088,2021-09-02 22:28:33,5,很轻薄，携带方便，，适合要求不高的人来用，个性回车键设计，很醒目。
63,16228424075,2021-08-31 16:20:21,5,"很好啊 物流也很快 用用看效果
外形外观：很好看
轻薄程度：还OK 可接受范围"
64,16589535722,2021-11-06 23:04:54,5,运行速度特别流畅，屏幕分辨率也很高，外形既时尚又轻便，物有所值，真的是非常满意！
65,16618556225,2021-11-11 12:36:05,5,运行速度很快，16G内存用任何办公软件都是行云流水，而且机身质感非常好，轻薄，圆滑的外边框手感非常好，nvme是512G的，开机速度和零碎小文件加载速度非常快，很满意！
66,16441691119,2021-10-10 11:47:34,5,实物与描述的一样，质量相当好，发货速度杠杠的，除了噪音有点大，其他都很棒值得购买哦
67,16625021039,2021-11-12 08:56:46,5,"运行速度：还行
屏幕效果：显色不错
外形外观：电脑很好看也很轻薄，用起来很流畅，体验感很好"
68,16516345593,2021-10-25 16:05:18,5,"首先包装真的不错，很细心，包括快递员也超级认真负责
然后是刚开始操作不熟练和不会弄的时候，客服也在认真耐心回答我的问题
使用时候的声音我也能接受，总体来说这个价钱性价比真的不错
唯一就是发热，我用了大概2个来小时就发热，可能我一遍充电一遍在激活机子
如果是学生的话可以买的，推荐给学生哦
真心评价，希望对买电脑的人有帮助"
69,14787061866,2020-10-23 11:47:39,5,"外形外观：做工细腻无瑕疵，不愧是大品牌
轻薄程度：14寸的大小正好，轻薄本办公的话正合适
屏幕效果：画质细腻
运行速度：很快
散热性能：只浏览网页散热ok"
70,16426723595,2021-10-07 14:48:00,5,笔记本到货速度很快，12小时不到，很吃惊，质量怎么样先不评价，音乐效果真的很好
71,15960799732,2021-07-10 17:23:08,5,京东速度很快，618当天买，第二天收到货。这款笔记本总体来说性价比很高，开机非常快，外观小巧便携，颜值非常高，运行速度也相当的快，喜欢。
72,16200926206,2021-08-26 18:53:38,5,很好很喜欢，价格合适，挺好看，给朋友推荐，运行速度好，开机设置时候有点蛮烦要注册，弄了好久
73,16390226697,2021-09-30 22:19:43,5,物流很快，第二天就拿到了，银白色电脑非常好看，高颜值，使用也好，买给外甥学习用的，足够了！
74,16605295183,2021-11-09 13:02:41,5,颜值好高呀，爱了爱了，真不错，物流也超快，头天下单，第2天就到
75,16265549697,2021-09-07 16:19:15,5,"屏幕效果：颜色艳丽，效果惊艳
散热性能：办公三小时不发烫
外形外观：做工精细，美观大方
轻薄程度：超薄，携带方便
其他特色：华硕大品牌值得信赖
运行速度：闪电般速度，开机七秒，关机三秒"
76,15350020913,2021-02-25 08:05:04,5,第二次购买了，最牛的处理器，小巧的充电器。磨砂的屏幕，看一天不刺眼，价格很公道，，卸载了不必要的内置软件，流畅度真的很快，用8个小时无压力，女生的最爱
77,15766608364,2021-06-05 22:07:20,5,颜值相当高，开机速度特别快，配置很高，很喜欢，特别满意的一次购物，客服也很给力，有问必答
78,16346817908,2021-09-22 20:58:43,5,京东自营，质量保证，实属正品。京东物流，极速发货，第二天就能收到货了，京东购物，售后无忧，值得信赖！笔记本外壳材质非常好，细节漂亮，屏幕光线柔和且明亮，功能设计很人性化，是一款性价比极高的笔记本，推荐购买！
79,15596805099,2021-04-24 16:30:46,5,开机很快，运行速度也快，屏幕很舒服，不累眼睛。信赖品牌，一如既往的喜欢，很满意！用了两天，手感很好，键盘也舒服。大小合适，方便携带。推荐！
80,16616041367,2021-11-11 01:18:20,5,"第一个笔记本电脑！！感觉很不错！好喜欢?
外形外观：轻薄好看 银色的
屏幕效果：不错
运行速度：?
散热性能：一般
轻薄程度：很轻便！！"
81,16586487322,2021-11-06 14:51:07,5,电脑收到了马上上手，大小是我想要的，刚刚好，外出方便携带，以后去哪里都可以带上电脑了，而且很轻巧，特别喜欢，跑分也很高，办公学习很适合，还买了电脑保护膜装饰，我实在是太爱了！
82,16359389442,2021-09-25 13:40:48,5,"外形外观：外形好看。
运行速度：配置算是可以了，大部分的使用场景都可以满足
其他特色：回车键很有感觉。"
83,16169494731,2021-08-20 20:48:34,5,华硕笔记本老品牌了，物流很快，商家服务态度很好，有问题都会及时处理。会推荐给朋友！灰色的很高档，电脑小巧好用。
84,15913716345,2021-07-03 07:55:10,5,外观好看，颜色清新，键盘手感也不错，用了一段时间了，价格也合适，送货快，尺寸大小很适合，新机器各方面用着都很舒心，买的很合心意。
85,15392931234,2021-03-07 19:21:48,5,这个电脑颜值高，银色很耐看，音质也很舒服，特别是AMD的4700性价比高，性能强，硬盘配的英特尔固态，反应真的快，不玩游戏办公很好！！！
86,15946872596,2021-07-08 11:36:29,5,锐龙7 8核处理器简直太强大了，价格还非常低，性价比高的无敌，银色也很漂亮，简约大气！在炎热的夏季，散热效果也非常不错！
87,16541296404,2021-10-30 13:05:12,5,"运行速度：电脑运行速度很快，基本秒开机，固态硬盘还是很有优势的
屏幕效果：屏幕显示细腻，看着还不错，毕竟价位在这里，活动时候买的，非常划算
散热性能：不是很烫
外形外观：外形很漂亮！"
88,15779807407,2021-06-08 17:13:38,5,性能强大，开关机，操作丝滑流畅，8核的4700u确实给力，性能跑分都超过台式的10100了，核显也可以，整机性能接近十代i5无显台式机，办公和一般游戏绰绰有余，音效也棒，接口多，性价比很高！
89,16557407542,2021-11-02 08:30:34,5,宝贝收到了，太惊喜了，质量非常好，价格适中性价比很高，真是出乎我的意料！
90,15361646852,2021-02-28 10:34:36,5,买电脑还是来京东，售后有保障，用着也放心，特别喜欢华硕这款电脑，运行速度特别快，配置也很好，朋友推荐给我的，真的不错，华硕的售后支持也特别不错，都是人工在线，*****，很喜欢。包装也特别好，很精致，发货速度很快，感谢快递小哥的积极配送，感谢。
