,ID,发表时间,满意度,评论
75,16355238574,2021-09-24 16:53:14,5,非常喜欢这个电脑，考虑了很久，这个电脑的颜值非常的高，特别喜欢后面的那个标志，开机也很快，非常喜欢！
76,16107700204,2021-08-08 18:41:34,5,速度非常非常非常的快 电脑非常非常非常的好看 而且还很智能 很喜欢 感觉可以很开心的很幸福的打游戏了耶
77,16609240387,2021-11-09 23:29:10,5,"?电脑收到了，看的很帅气，绝对数一数二的笔记本，性价比高，144赫兹yyds,17寸大屏，舍友羡慕的很，包装得很好，物流非常快，客服态度很积极，有问题及时解答！总体来说非常满意！"
78,16592776216,2021-11-07 15:14:26,5,"金属机身，非常炫酷，3070游戏本能做到这个厚度非常不错了。散热很给力，就是风扇声音比较大，因为金属机身，一把游戏下来后面能烫伤?
这个配置，性能爆炸，性价比蛮高的。"
79,16365903996,2021-09-26 16:27:07,5,挺好的，开机那些都很快，打游戏也特别好，永劫无间随便玩，打LOL一点也不卡，打爆对面
80,15826366944,2021-06-18 11:24:58,5,"我想说，第一次入**神，是真的很香。
无论是外观，配置，还有物流，都很满意。比我想象中的要轻薄，比之前的游戏本薄太多太多了。还有rgb跑马灯，很满意。满血的3060，加上i7-11800h。三星的硬盘和内存，2k屏幕，我想这个价格找不到对手。"
81,16378877635,2021-09-28 22:05:11,5,"包装保护：三个箱子，保护的特别好，没有任何破损。
外形外观：科技感十足，银灰色配色很耐看。
画面品质：十分清晰，色彩鲜明。
运行速度：无比流畅。
游戏效果：大部分游戏都能无压力运行"
82,16565119181,2021-11-03 10:22:40,5,很炫酷的游戏本，16运行内存+512固态+3060显卡，绝大多数3A大作都可以流畅运行，16英寸大屏，2.5k分辨率很细腻，看电影体验感，165hz高刷新的屏幕很丝滑，散热的话绝对没问题，平时正常用风扇也不吵
83,16395639970,2021-10-01 19:33:00,5,"包装非常精美，电脑17.3大屏幕也非常的nice,在游戏本里面颜值外观也是非常的好看，不管是游戏性能，还是流畅度也超乎你想象，起初我还担心散热不行，但是使用了之后玩游戏基本不掉帧，散热效果非常好，画质也很不错，客服也非常的耐心给回答解决任何问题，很不错游戏笔记本，性价比非常的高，从此我也是雷神粉一枚了。"
84,16378438520,2021-09-28 20:34:46,5,"第一次买笔记本查了不少信息就选了这款
上上网课打打游戏完全够用的
包装完好  设备齐全  客服很有耐心 
物流速度快凌晨下单下午五点就到了"
85,16227124074,2021-08-31 11:59:45,5,头一次购买游戏本，到手后感觉非常不错，外观颜值非常高，运行速度非常快，流畅不卡顿，自主降温系统玩电脑不，热爱辽爱辽
86,16422601059,2021-10-06 18:37:45,5,快递真的非常的快，不到一天就收到了快递。而且包装很好，电脑外形也很酷，简约而大方，可以的。客服也不错，客服挺耐心给讲解的。键盘质感也可以。而且能在这个价位买到这样的配置，很少。祝雷神系列能越办越好！
87,16085723283,2021-08-04 14:33:46,5,"性价比很好，雷神这款的电脑真的好用，
RPG真的的很炫酷，键盘手感在我用过的三款里最好的手感，舒适，2k165的显示器也很舒服，散热也不错，开狂暴模式能降个6-10&deg，虽然声音有点大，带上耳机就听不见了，总的来说还可以，就等后面开显卡直连了"
88,16558886589,2021-11-02 12:43:17,5,非常不错     外观大气上档次    买了我觉得非常值得    用一来手感也不错  真的可以    配置也是非常满意
89,16101347054,2021-08-07 08:48:46,5,"包装保护：三层纸箱防护，保护很好，完好无损！
外形外观：时尚大气，led灯很有感觉！外观颜值比较高！
画面品质：画质细腻，电影、阅读都很舒服！屏幕可调节常看不刺眼。
跑分评测：没装跑分软件，不过硬件都是符合实际，性能差不了！
运行速度：运行快！无卡顿！开机、启动软件、响应绝对迅速。值得推荐和购买！"
90,15980902418,2021-07-13 22:46:23,5,很给力的本本，第二次购买了，相当满意，两台笔记本都是雷神，外边炫酷，运行速度快，
91,16126658462,2021-08-13 08:03:23,5,"包装保护：拆了三层包装才打开，包装的很严实，放心。
外形外观：帅气，是游戏本的特色
画面品质：高清，很不错哦
跑分评测：跑了67万分呢
运行速度：速度快，不卡，日常游戏均够用
游戏效果：适合打游戏，很棒"
92,16130128938,2021-08-13 20:56:36,5,好了好久才决定买这款，颜值高，配置够用，性价比高，之前买过雷神的电脑，这次也是坚定的买雷神，用了一段时间了，运营很流畅，没有问题，平时玩玩ol也不卡顿，推荐！
93,15835334269,2021-06-19 19:46:34,5,选择很久，终于选择了雷神911mp，英特尔最新酷睿处理器真的非常强劲，搭配3060显卡，性能已经得到保证，儿子高考结束，期望能有好的成绩，带上雷神一起去满意的大学
94,16378558796,2021-09-28 21:05:03,5,"外形外观：外表看起来很好看
画面品质：高清，画质很好
运行速度：还可以运行不慢。
包装保护：保护很好很安全，层层保护不伤机
游戏效果：运行速度很快，玩元神一点也不卡，也没有出现掉帧的现象。"
95,16466278910,2021-10-15 17:06:08,5,期待了好久的电脑终于到了 激动的心 颤抖的手  电脑非常流畅 游戏还在下载 电脑外观非常帅 也不怎么重 爆赞！
96,16577221404,2021-11-04 22:35:11,5,"包装保护：物流运输回来时，包装是包装的挺不错，保护的也挺好的。
外形外观：挺酷的，键盘是发光的那种，屏幕后图标和闪光。拿在手里感觉凉凉的，摸上去非常的舒服。
画面品质：嗯，画面品质挺好的，比我家原先台式的和朋友的笔记本电脑画质好多了。
运行速度：运行速度的话也比别人的也快。"
97,16373009793,2021-09-27 18:54:01,5,"包装保护：三层包装，内包装还有防伪防拆贴纸，非常安全，不担心假货或者物流掉包。
外形外观：外观很酷，电源线粗大感觉很凶猛
画面品质：感觉还好，回头打游戏试试看
跑分评测：如图，一边装软件一边跑分的，会不会影响分数？
运行速度：新的，反应非常快
游戏效果：我打魔兽DOTA这配置满满的一点问题没有"
98,16093724165,2021-08-05 16:25:24,5,电脑收到，外包装非常完美，电脑外形外观非常漂亮，画面品质非常清晰，非常漂亮，好用，非常好，是我想要的，好评，赞，客服态度非常好，好评，赞，物流快，快递人员服务态度非常好，好评，赞，还向朋友推荐了，朋友也准备下单购买
99,16593852447,2021-11-07 17:46:38,5,"快递包装很严实，用了3层盒子，发货很快，用了几天才来评价，机子给我很多惊喜，外观很好看，性能也很好，CPU 显卡 都很nice,下了个大型FPS游戏（战地五），性能全部拉高，玩着一点没问题，良心商家，好评！"
100,16061566153,2021-07-30 22:42:08,5,第1次买电脑，就入手了雷神911zero，一个是性价比高，最近也有优惠活动，也在我的预支范围内，设施配置都很满意，屏幕也很好，灯效和风扇特别帅气，功能也特别全能和强大，送货速度快，包装的好，没有出摩擦碰损，画面品质高，游戏效果强，该送的东西也有，客服服务态度好。
101,15033824521,2020-12-12 12:58:15,5,"包装保护：外管保护很好，有三层纸壳子，内部还有泡沫
外形外观：外观很帅，机械科技感
画面品质：画面高清，看着很舒服
跑分评测：跑分比预计要高很多，很满意
运行速度：运行速度：运行速度还是比较快的 
游戏效果：游戏顺畅"
102,16385003740,2021-09-29 20:04:23,5,"外形外观：外观非常上档次，刚拿到的时候非常喜欢这外观。
画面品质：画面也可以没有瑕疵跟黑点，打游戏画质完全没问题。
运行速度：运行不卡顿非常流畅。
包装保护：包装也非常好，三层保护。

总体来说相当不错的，物流也快今天买明天到，电脑也非常流畅，对于我一个大学生来是平常计算机课程做作业打游戏完全没有压力非常值得购买。"
103,16275379834,2021-09-09 13:19:20,5,直接粉了，买了雷神的电脑，键盘，鼠标，耳机，鼠标垫，直接全套，太爱了，电脑制定手感细滑，外观特别好看，舒服?，建议大家购买，真的性价比高，又实惠有好看，性能又强，值得入手。
104,15997512305,2021-07-17 17:15:35,5,配置高，性能强，运行速度快，非常喜欢雷神这个品牌，颜值性能都是爆表，键盘用这舒服，大力支持！！！
105,16549620970,2021-10-31 23:47:42,5,东西第二天就收到了，用了几天之后体验感觉非常不错，3060的显卡什么游戏都可以带得动，屏占比也非常不错，是理想中的产品，质量不错，值得点赞
106,15325113099,2021-02-17 12:20:03,5,"外形包装:三层纸盒包装，电脑用泡沫保护，很好
电脑外观:A面很有科技感，摸起来也很舒服，很喜欢
跑分测试:比预想的好很多，物美价廉
游戏体验:很流畅，没有卡顿
整体效果:散热也好，声音不大，非常喜欢"
107,16584900056,2021-11-06 10:14:07,5,"真的一级棒，电脑运行非常流畅，高级感满满，特别是星球大战主题，我特别喜欢，作为我的第一台入门游戏本非常不错，值得购买
运行速度：很快
游戏效果：满分
外形外观：炫酷"
108,16563067294,2021-11-02 23:17:40,5,收到电脑很激动，快递保护的真好，三层防护，拿到电脑手感也特别好，朋友都过来看了，也要买一个，梦幻五开一点不卡，还可以开一些其他的！
109,16359549768,2021-09-25 14:18:52,5,"外形外观：外观是真的帅气，有质感，爱了爱了
运行速度：16G内存妥妥的没毛病，很快
画面品质：没得挑，很不错，显示度很流畅，画面清晰
跑分评测：配置很高，用起来很流畅"
110,16611051220,2021-11-10 11:45:41,5,"包装保护：一共三层包装，外包装是快递盒，第二层是硬壳，，内里有泡沫包裹，
画面品质：fps很稳定，IPS的屏幕看着还不错，响应也快，色温色差都是很不错的
运行速度：很快，开机键按下去就有反应了
游戏效果：选择游戏模式，在按下FN+1，散热风扇直接起飞，温度控制很不错，"
111,16621194023,2021-11-11 18:08:27,5,真心很不错哦，外观很时尚大气，运行速度：超快；屏幕效果：高清；散热性能：还可以；外形外观：酷炫；轻薄程度：很轻薄；其他特色：喜欢，这款笔记本的处理器硬件和性能我都很满意，外观酷炫，重量轻薄，非常适合移动办公和携带，而且能够满足绝大多数场景应用。总结下，这雷神911Air星战系统稳定性能好，主要是它的续航能力强，散热功能好，对于新用户很友好，教授上机基础，智能系统好。
112,15450514307,2021-03-22 20:23:06,5,我一开始还担心在网上买电子产品不好，但是，收到电脑后，我得顾虑被打消了，因为，包装的特别严实，还有识别标识，一看就知道有没有被人拆封过。电脑特别的炫酷，果然是游戏本，很科幻的壁纸，我作为一个妹子也完全被吸引了，然后也不是很重，还是挺好的。运行速度也很好，我买来做工科毕业设计的，我觉得运行设计软件，挺不错的，反正软件安装好，运行的特别流畅，还有客服也特别耐心，一直给我解决问题，不用担心售后啦。还有充电也很快呢。我朋友推荐的雷神游戏本电脑上手三天了，使用感还不错。完全可以。
113,16059574097,2021-07-30 13:42:59,5,"本次购物很愉快，雷神科技笔记本很有科技感，做工也很细致，电脑运行速度很快，我是做设计工作的，对电脑要求很好。
        同时物流非常快，昨天下单，今天就送到。感谢快递小哥！
        产品包装很好，三层纸盒包装，质量杠杠的！"
114,16573174305,2021-11-04 13:57:46,5,"包装保护：包装的的非常好，很结实。
外形外观：买回来跟我想象的一样，个人很喜欢
画面品质：画面很好，没问题
运行速度：运行速度贼快，开机也就五秒左右
游戏效果：玩英雄联盟一点问题没有"
115,16446754249,2021-10-11 13:39:37,5,电脑确实不错，发货用了3层包装确保了东西能安全到客户手里。机器也非常漂亮，金属后壳略显大气。按键流畅，运行游戏也非常的快
116,16565330612,2021-11-03 10:55:26,5,刚收到货的一瞬间很激动，终于有自己的电脑了，太兴奋了，电脑外观真的很好看，雷神永远的神，还买了配套的无线鼠标，期待
117,16376276910,2021-09-28 12:37:10,5,"包装保护：很好
外形外观：科技感十足
画面品质：优秀
跑分评测：很帮
运行速度：很快
游戏效果：真棒"
118,14570348581,2020-08-25 19:58:35,5,非常满意的一次购物 包装非常好 保护的很好 电脑的外观上档次 让人爱不释手 电脑配置也高 跑分接近40万 也玩了各种游戏 特效拉满 非常流畅也不发热 很满意的一次购物。
119,16366438774,2021-09-26 17:50:48,5,"电脑外观简洁高端大气，科技感十足，激活过程简单方便，运行不卡顿，玩游戏温度不高，客服讲解很耐心，大爱雷神！
包装保护：非常安全，无磕碰破损
外形外观：高端科技感十足
画面品质：画质美观，很清晰
运行速度：超级快
游戏效果：发热低，散热快，运行流畅，轻松驾驭大型游戏"
120,16349903311,2021-09-23 14:36:35,5,关注雷神很久了，最近要用电脑，所以都没犹豫，直接就把星战四代拿下了，样子酷炫，配置高端，拿游戏本当办公，速度很快，开机只要四五秒，果然没让我失望，用个几年应该没问题！京东物流也给力，第二天一大早就到了！
121,15861791973,2021-06-24 11:00:45,5,牛牛牛，炫炫炫 物流很快 隔开就到了 迫不及待地就去拿了快递 迫不及待就打开了 果然没有失望 颜值很高 也很流畅 性价比很高 物超所值
122,15329290466,2021-02-18 22:42:38,5,"包装保护：包装完美、外观设计风格非常好看
外形外观：外观漂亮帅气
画面品质：画质清晰明了
跑分评测：跑分56万
运行速度：运行速度快、温度低、稳定性好、
游戏效果：游戏体验爽翻天、强力推荐给大家"
123,16587242489,2021-11-06 16:56:00,5,包装非常严密内外好几层根本不担心会有破损，新机启动全程语音提示非常方便，本来以为1080p看的不太舒服但其实也很清楚，运行很流畅电脑运作时没什么声音，暂时还没有运行游戏，手机拍照不是很清楚实物看起来很炫酷！
124,16600395469,2021-11-08 16:55:19,5,到货迫不及待的拆开了，包装完美，机子无任何问题，玩了下游戏，完美运行，不卡顿，在同类型17寸里算性价比超好的了，跑分88w
125,16484301655,2021-10-19 10:59:23,5,"包装保护：很好，收到的时候有好几层的保护
外形外观：非常帅气
画面品质：刚用没几天，但是感觉还是不错的
跑分评测：刚收到，没跑过感觉应该不会低
运行速度：很快，打游戏什么的也不会卡
游戏效果：非常棒，就是因为打游戏才买的这款电脑"
126,16292437930,2021-09-12 15:04:06,5,真的非常非常好，大大的点赞，我也非常非常喜欢，尺寸也非常大，打游戏也非常好
127,15874468779,2021-06-26 19:57:51,5,"包装保护：包装特别的好，两层包装完好。很用心。很贴心。
外形外观：个人特别喜欢这个简约的设计，虽然简约，但是特别的霸气，调调很足。
画面品质：刷新率很好，画面特别的清晰和锐利，能够更好的还原真实的色彩度，图形，视频剪辑都没问题，玩游戏也不卡顿，不拖影，没有撕裂。特别的棒。
运行速度：完全没问题，配置很强大，极速强大。
游戏效果：不掉帧，不卡顿，不拖影，不撕裂，玩游戏绰绰有余。"
128,16425316348,2021-10-07 10:14:27,5,十一期间抢购的！到货速度非常快，包装里三层外三层的非常严实，机身强度很高，开机很快，颜色很艳丽，散热很好，相当满意的一次购物！
129,16101612733,2021-08-07 10:07:59,5,"包装保护：三层纸盒保护完好，一点没有问题
外形外观：外观新潮，年轻人都喜欢，符合年轻人的审美
画面品质：画质清晰，色域饱满，京东方的屏幕就是厉害
跑分评测：跑分很高，大部分游戏都可以玩，没有问题
运行速度：开机秒开，运行速度特别快
游戏效果：游戏畅玩，lol两百帧以上，大型游戏无压力"
130,16559469328,2021-11-02 14:07:22,5,不得不佩服物流速度，发货太快了，晚上下单，第二天早上就送到了！超级棒。打开看了是我自己喜欢的类型。游戏玩起来倍溜！超爱超爱。可以组队玩起来。上班办公也超级棒，总之完美~
131,16275166044,2021-09-09 12:22:57,5,机器收到，包装很好，机器外观也很好看，控制中心很有可玩性，灯光啥的很炫，一键风冷性能强大
132,16063396671,2021-07-31 12:28:57,5,电脑收到了，使用几天下来感觉非常不错。主流游戏玩下来非常流畅，散热也比想象中的好很多，用的性价比也非常让人满意，以后也会推荐朋友购买，
133,16560366780,2021-11-02 16:38:53,5,电脑非常不错啊，客服态度非常好，而且是正品，价钱还比实体店便宜好多电脑很好，开机挺快的，运行流畅，挺好用的，流畅迅速，是正品。成功下车●
134,15897623512,2021-06-30 19:28:49,5,视觉感十足 超赞的一次购物 哥哥帮我推荐的 一开始还不太愿意买 到手之后就发现物超所值 推荐购买 先使用一段时间再过来追评 希望到时候还是有现在的心情 哈哈哈
135,15872398275,2021-06-26 12:56:28,5,电脑外观好，反应速度快，画面清晰，打英雄联盟一点都不卡，散热性能很强大。
136,15879037306,2021-06-27 18:13:42,5,公司办公采购的笔记本电脑，一拆开包装就满满科技感，激活使用后外观很酷炫，配置也很高，完全胜任日常办公使用。11代I7加RTX3050，散热也不错，高性能的配置丝毫不会过时，本次一次性采购了十台，非常满意这个电脑。
137,15840718222,2021-06-20 18:20:52,5,19号最后一台被我抢到了，20号中午就收到了！马上鲁大师评分150万分，很强大！既有颜值又有实力，性价比也好，超出预期！
138,16069848739,2021-08-01 18:26:01,5,"包装保护：里外三层的纸壳箱子保护，非常安全可靠并且给力！
外形外观：霸气时尚的外观，我很喜欢的触摸板配色，老婆居然不喜欢，哈哈。
画面品质：画质细腻，2.5K的屏幕果然不是瞎扯淡的啊。
跑分评测：本人不注重跑分，况且已经有那么多人跑了。
运行速度：速度自然是杠杠的啊。
游戏效果：效果不错，非常的棒。

哈哈，我敢说东北仓的最后一台被我拿来了，虽然不是首发价格，不过还是很给力了。两个电源适配器，一个是暗影2plus的，一个是ZERO的，终于可以减负了。哈哈"
139,16451533710,2021-10-12 16:25:43,5,到货后迫不及待打开，太多惊喜!首先包装严实，里三层外三层，还有气囊填充，其次颜值这块雷神大黄蜂真的没话说，张扬而不失优雅，机身强度够硬，屏幕单手可开!按键触感细腻柔和，回馈有力!一键起飞哦不，一键降热那叫真的有力，感觉就像涡轮增压，瞬间马力不断，强力散热!16寸屏幕大小合适，25K分辨率外加165HZ刷新率黄金配比!
140,16394269328,2021-10-01 15:02:42,5,送货很快，从上海调货，隔天就到了。电脑外形新潮、工艺精湛。屏幕色彩丰富，画面逼真，分辨率高，16:10的屏，视界更好。测试多款游戏，画面开到最高也能流畅运行。散热良好。多次用鲁大师评测硬件性能评分160万左右，光追性能在6.9万左右，光追开启dlss大幅提高帧率到160%左右。1个多月前给女儿买了雷神rtx3070那款，她说很好，所以这次直接买了rtx3080这款。
141,16198022657,2021-08-26 13:59:48,5,"包装保护：三层保护，安心，放心，舒心，贴心，爱心。
外形外观：时尚，流行，运动，一颗青春的心。
画面品质：流畅，细腻，色彩丰满，亮度高。
运行速度：唯一遗憾的就是内存买小了应该选择16G的，这样运行游戏就更加得心应手了。
游戏效果：3050显卡市面游戏基本都可以满足，我只要LOL完全满足。"
142,16587949377,2021-11-06 18:44:39,5,"包装保护：包装完好无损，而且特别好看
外形外观：超级轻薄，好看，爱了
画面品质：屏幕图片特别清晰，分辨率很高
跑分评测：打游戏还不错，不卡顿，运行流畅丝滑
运行速度：开机速度特快，打开各种程序都特快
游戏效果：运行各种大型游戏好快"
143,16361512676,2021-09-25 21:31:14,5,"包装保护：三层保护让我开包装时就已经放下心了
外形外观：外观炫酷，背面星战光剑直接爱了
画面品质：画面很好，流畅，亮度也很高，尼特很高
跑分评测：跑分接近110w，nice的受不了了
运行速度：运行速度，开机两秒你敢信，连接网速快的飞起
游戏效果：游戏效果也很好"
144,16618392645,2021-11-11 12:12:11,5,包装完整，精致，开机速度快，大屏看着特别舒服，屏保炫酷。完美非常棒。
145,15315937182,2021-02-12 11:20:45,5,"外形外观：第一感觉就是非常小巧 边框非常小巧 比我以前的电脑小巧太多了
画面品质：60赫兹刷新我感觉够用了毕竟我不是经常玩游戏"
146,16560407611,2021-11-02 16:45:54,5,"非常好，喜欢好久了，推荐大家购买。
外形外观：大气
包装保护：四层保护，非常安心
运行速度：运行速度很快，开机速度也是非常的快
画面品质：画面也非常的好"
147,15843340498,2021-06-21 08:34:58,5,外观超级漂亮，做工精细，性能彪悍，大师跑分149万分，屏幕显示清晰，分辨率高，刷新率高，适配器功能230瓦，满足满血3070显卡要求，本来买了个R9+半血3070宏基笔记本，退了，还是这个性能好。
148,15834070245,2021-06-19 16:09:08,5,昨天就收到的快递，说实话快递真的很快我15号晚上才买的，17号就到了，贼快呀，好评；电脑打开运行的也很快，系统设置很不错，进入系统的时候还可以语音；而且客服也很给力，帮忙解答各种问题；买给我老公办公用的，他很满意，也推荐了身边同事和朋友看，嘿嘿。
149,16436618507,2021-10-09 11:45:57,5,"外形外观：高端大气上档次
包装保护：没有瑕疵 里里外外三层 没有任何问题
运行速度：感觉还蛮快 正常游戏游刃有余
画面品质：还挺好 个人喜好                                           总的来说  同价位非常好了已经，喜欢的朋友可以入手了"
150,16462418009,2021-10-14 22:39:08,5,"包装保护：包装完好无损，无异样，快递小哥态度很好，配送也很快！！
画面品质：屏幕清晰度和描述一样，无差异
游戏效果：玩了游戏感觉也很不错，很流畅
外形外观：外观挺酷的，银灰色的就很奈斯啊，"
151,12765639414,2019-05-15 14:48:39,3,没什么，将就用了。只能说造型不错
152,15949861788,2021-07-08 18:21:11,5,物流非常快，包装完好，没有破损， 没有划痕，电脑?非常漂亮，内置也很好。笔记本整体外观时尚潮流，轻薄小巧，方便携带，整体配置较为不错，显示屏细节清晰盈亮，对于我办公商务绰绰有余，
153,16173734050,2021-08-21 16:48:14,5,真不愧是雷神的游戏本电脑，144赫兹高刷新屏幕简直流畅到丝滑，造型非常喜欢，尤其是键盘气氛灯，电脑配置也很强， 简直绝配 打游戏最得劲儿了。哈哈哈哈。给力！！！
154,16573967126,2021-11-04 15:50:59,5,"京东物流速度不用多说了?包装的很好，拆了三层才拿出来电脑主机！
外形外观：外观时尚又科幻 适合游戏适合学生用
运行速度：运行速度不输i7多少，挺快的，对于我来说足够了
刚刚到手还没试试手，过几天用一下再做追评！有赠品 官方还有价保。妥妥的?"
155,16403023830,2021-10-03 01:21:47,5,"使用了一天,玩永劫无间跟csgo一点都没问题，完全能带的
起,散热特别快,只要游戏一停,分分钟就把温度降下
来了。玩英雄联盟什么的都简简单单，特别流畅。物美价，
外形外观：超帅
包装保护：完全包装的严严实实"
156,15840236386,2021-06-20 17:01:17,5,这个本子真是太好了，英特尔最新酷睿处理器i7-11800h，3060的显卡，屏幕也够用，自己在加一块硬盘，真的是香香的了，用起来可太爽了！！！
