,ID,发表时间,满意度,评论
0,16406232966,2021-10-03 19:05:16,5,"运行速度：相当快 开机也快 上手很快
屏幕效果：也好
外形外观：非常喜欢
轻薄程度：很薄的那种
在京东已经买了两个华硕的笔记本了 信赖华硕的品牌"
1,16453165388,2021-10-12 23:04:56,5,华硕品质坚如磐石，名不虚传，第一感觉质感爆棚，我是直播间买的，而且物美价廉，同等配置价位某想5千多，而且客服人员也特别的有耐心，因为我就是话痨，，而且当时还感觉不太放心，推荐购买，运行速度特别快，当年自己组装第一台游戏电脑，主板就是用的华硕Z97，一直用到现在，所以我还选华硕
2,16277657484,2021-09-09 22:16:59,5,昨天收到货了，迫不及待的打开使用，挺好的，运行速度很快，外观很大气，银色的显高档大气！屏幕很清晰！华硕笔记本电脑，杆杆的！
3,16505348829,2021-10-23 12:10:48,5,发货速度快，电脑颜值不错，键盘阻尼感不错，整体运行速度快，感觉真香！！！超薄设计，散热目前觉得还可以！！！！！！！以后再追评！
4,16448832063,2021-10-11 22:27:09,5,"运行速度：很快
屏幕效果：精度高
散热性能：良好
外形外观：漂亮
轻薄程度：轻薄
其他特色：内存大，性价比很高，第三台华硕电脑了，好品质值得信赖，赠品包和鼠标很贴心"
5,16490611076,2021-10-20 15:58:54,5,"电脑漂亮，网速很快，用它来接单很放心，发个朋友圈推荐同行都买这种电脑
运行速度：快
屏幕效果：好
散热性能：好
外形外观：漂亮
轻薄程度：很好
其他特色：综合都很好"
6,16313873703,2021-09-16 18:07:26,5,给**买的，外观时尚，系统很流畅，她很满意，用段时间再来追加吧。
7,16434588127,2021-10-08 23:09:31,5,很好的电脑，一拿到手就赶紧开机，设置，进入系统。这台电脑的开机速度很快，竟然在10秒以内。屏幕很清晰，体积也不大，方便携带。希望接下去能耐用，一直陪着我。等用过一段时间再来追加评论和体会。今晚用它工作了一会，体验很好。
8,16455226736,2021-10-13 12:35:50,5,对比了这么15英寸大屏，这个价没多少选择，纠结很久还是选了华硕，音效是真的不错，开机也快，非常满意
9,16457626971,2021-10-13 21:14:03,5,"开机速度很快
屏幕效果：1080P的高清屏幕显示很清晰
外形外观：外观金属感强，非常时尚大气
轻薄程度：机身轻薄
其他特色：这款机器一个明显的优势就是配了两块硬盘，一块256G的固态硬盘可以装系统和程序，一块1T的机械硬盘可以用来保存资料，不用担心硬盘空间不够用。另外还预装了迈克菲的杀毒软件，可以非常优惠的价格使用一年。"
10,16513245404,2021-10-24 21:22:36,5,收到用了一天，感觉挺好的，开机很快，屏幕很清晰，键盘手感很好，不算很重，女生用还行。这款笔记本性价比挺高的，送的鼠标和电脑包也很好的。太划算了！
11,16582738400,2021-11-05 20:43:59,5,"清晰的屏幕，看着还不累眼镜，运行速度又很好，华硕果然很好
轻薄程度：虽然比我过去的14寸大一些，但是薄了三分之一，非常完美

散热性能：开机再也没有CPU转速的声音了，而且还不会个把小时内发热

很喜欢

送的原装鼠标有质感，电脑包也很不错哟"
12,16471751684,2021-10-16 17:52:38,5,"运行速度：速度超快，基本是秒开哦。
外形外观：颜值在线就我选的这款啊，银颜色的还可以。屏幕边框稍微有点宽，跟我的荣耀比起来好像还宽一点。自己装好了ps AI和cdr运行流畅。第2天把windows10升级为11了，体验感觉也很好。用了这么久一直没有出问题，也没卡过，非常棒啊。"
13,16309980525,2021-09-15 22:01:57,5,前天买的，用了几天，感觉物超所值，开机特别快，基本上10秒都用不了就开机了，装了2020的cad运行也非常流畅，看视频清晰度很棒，很好用，赠送的鼠标，电脑包也很实用，非常棒
14,16450936311,2021-10-12 13:53:37,5,第一次在京东买笔记本，看到的第一眼就超喜欢，立马开箱按照系统提示一步一步的安装系统，很快就安装完成，很惊喜。
15,16495061307,2021-10-21 13:05:35,5,"运行速度：开机速度很快，用了几天也没有卡顿的现象
屏幕效果：屏幕很大，追剧看着很舒服
散热性能：目前未发热过
外形外观：很漂亮呀！！颜值党快冲
轻薄程度：不重，方便携带"
16,16485770496,2021-10-19 15:37:33,5,其他特色：不多说了，直接上图我自己买了贴纸，自己贴哒 外观材质：银白色的外观很适合女孩子，很漂亮又低调。而且电脑很轻薄，拿在手里一点都不沉女孩子完全OK。 电脑性能：酷睿i5 11代非常流畅完全不会卡顿。我一般都是做文件做表格之类的，用起来非常顺手，偶尔打打游戏也不会卡，非常棒。还送了静音鼠标手感超级好。
17,16640730608,2021-11-14 13:25:14,5,原装正品！华硕电脑大品牌，用料上乘，做工精良，开机非常快，操作反应迅速，不卡顿。商家服务一流，内外包装严实，送货速度非常快。
18,15443880179,2021-03-21 01:41:02,3,打游戏 LOL 打团就没怎么行
19,16452577425,2021-10-12 20:31:06,5,银色11代i512G＋256G＋1TB＋2G独显。今天刚收到货，一打开看，哗：开机好快，上手也很快。外观很大气，屏幕很清晰，运行也非常流畅。非常满意的华硕笔记本电脑。赠送的鼠标和包包都是很实用，非常满意。
20,16458060369,2021-10-13 23:21:50,5,"京东就是快，晚上下的单子第二天就到了！
IPS屏幕显示效果很细腻。设置好以后，开机速度8秒，其他反应方面要很快，非常满意！这个配置对学生党足够了，未来几年都不需要换电脑。"
21,16486015967,2021-10-19 16:26:25,5,"非常好，屏幕大重量轻，双硬盘，启动快，存储资料多，
独立显卡，较大的3D以及matlab030G大小的软件，CREO，均运行正常，分辨率高，看视频非常好。
绝对是居家办公的利器。充电器也小巧便携，赠送的鼠标，电脑包也蛮不错的，值得购买！"
22,16372507432,2021-09-27 17:25:35,5,轻薄，手感很好，开机速度很快，系统运行流畅，显示屏效果也好，看起来画面感十足，散热也不错，按键灵敏，独立显卡很可以的，值得。
23,16546866042,2021-10-31 15:56:00,5,"质量很好，很不错，商品描述一致，我很喜欢，符合我的期待值，发货也挺快的，很满意的一次购物，希望2021老板发大财！有活动记得通知我~
运行速度：很不错了 性价比很高
轻薄程度：符合我的预期"
24,16440789765,2021-10-10 08:39:44,5,电脑和赠品收到了，电脑非常满意，运行速度快，电脑银色很喜欢显霸气，客服很有礼貌讲解的很详细，点赞?，华硕电脑品牌值得信赖。
25,16580687609,2021-11-05 15:28:17,5,看中华硕大品牌，整体外观不错，颜色也大气，速度售后店专业师傅说非常不错。直播间下单，还送了包和鼠标，整体满意，相信华硕。
26,16545449818,2021-10-31 10:39:50,5,"运行速度：电脑收到了，外观很漂亮，运行很流畅，我很满意
轻薄程度：漂亮
散热性能：很好"
27,16467876223,2021-10-15 22:36:59,5,"运行速度：使用了两天速度快
屏幕效果：屏幕效果佳
散热性能：散热效果很好，长时间使用也没怎么热
外形外观：银色外观很大气
轻薄程度：厚度也很适中
其他特色：发货速度快，还送了鼠标和电脑包，客服服务也挺好的，有问必答."
28,16270299122,2021-09-08 13:01:34,5,电脑符合预期，外形轻薄有质感，运行速度很流畅，屏幕色彩光泽饱满，是一台很不错的电脑相对推荐。
29,16436800961,2021-10-09 12:36:11,5,"屏幕效果：清晰
运行速度：开机很快，使用也很顺畅
外形外观：颜色挺好的，有质感
轻薄程度：比较薄，携带方便"
30,16367655392,2021-09-26 20:53:50,5,很满意的一次购物，物流速度也比较快，跟卖家描述的完全一致，非常满意，完全超出期望。性价比高，非常适合学生学习和办公室办公所需。对于华硕这品牌一直都很信赖，也推荐。包装非常仔细，严实，快递员的服务态度非常好，赠送的礼包的质量也很好，尤其个包包很合适。
31,16351008445,2021-09-23 18:58:56,5,"跟实体店没有区别，还便宜，喜欢！外观干净漂亮，个人感觉大小也挺合适，找了很久选的这款，大爱！
运行速度：正常
屏幕效果：大
散热性能：好
外形外观：大方"
32,16606342284,2021-11-09 15:49:05,5,"简洁 流畅金属质感的外观、手感收到就爱了！ 
 买给女儿作业用，问了专业人士这样的配置，这样的价格超实惠！"
33,16572669269,2021-11-04 12:40:58,5,?非常漂亮，做工精细，颜值担当，非常方便，?喜欢的朋友可以下手！非常值得信赖的品牌，质量有保障!
34,16275180848,2021-09-09 12:27:40,5,非常满意的一次购物，物有所值，比实体店里实惠多了，电脑真的很好，因为非常非常薄，并且很好用！
35,16351439489,2021-09-23 20:42:33,5,性价比很高，外观漂亮，固态加机械硬盘，满足了速度与安全的两重要求，开机速度超快，电脑反应灵活，办公娱乐的好帮手，希望华硕不要让我在后续使用过程中失望！
36,16485895411,2021-10-19 16:02:45,5,性价比非常高的一款电脑啊，开机速度贼快，使用流畅不卡顿，银色外观，简单又大气。赠送的电脑包跟鼠标也是很好的。推荐推荐推荐哟~
37,15417871878,2021-03-14 07:42:18,5,收到货三天了，忙着试用一下，现在才来评。用着很流畅，上网速度快，连用几个小时也不发烫，散热好，机身很轻薄，15.6也不觉得大，总体来说，好，很好的一款笔记本！我喜欢
38,16393389640,2021-10-01 12:04:25,5,收到货 太哇塞了 质量好  清晰度高  运行特别快  屏幕大小正好  自带护眼模式  超级棒  店家还赠送了 包包和鼠标   很暖心  值得信赖
39,15384249559,2021-03-05 15:45:37,3,"开机速度很快，但感觉屏幕不够清晰。
不适合玩游戏，特别是LOL这种爱好者不建议买。"
40,16568437358,2021-11-03 19:13:29,5,"运行速度：很快，
屏幕效果：高清
外形外观：美观大方得体
轻薄程度：挺薄的，
快递速度也很快"
41,15842277602,2021-06-20 22:46:55,5,618抢购的华硕笔记本电脑到货了，赶上大促，收货比平时晚了一点点，时间上还是能够接受的，到货迫不及待的开箱体验，速度很快，设计比较简洁，款式中规中矩，赞&hellip
42,16518100263,2021-10-25 21:42:32,5,电脑很满意，店家也很耐心的给讲解了。另外必须说一下这款电脑的显示清晰度，确实比某基某尔性价比更高！还给带了鼠标和电脑包，一套都有了，赞！
43,15399023416,2021-03-09 11:00:16,5,超级棒，电脑屏幕很大  非常清晰  硬盘大  再不担心资料无处可放了  客服非常优秀， 物流给力  包装时候还用了帮宝适箱子加了保护  贴心。开机很快  作设计图时候 我尝试打开几个设计软件 依然强劲给力   没有辜负购买前各种纠结  京东给力
44,16462289233,2021-10-14 22:01:22,5,电脑和赠品刚收到就迫不及待的打开，超乎想象非常美观大气，运行速度也非常快，散热性能，屏幕效果都不错，外形外观都非常喜欢，华硕电脑真的不错。??
45,15569759076,2021-04-17 13:51:15,5,发货速度很快了，然后电脑持久，充电一次可以用很久，而且充电时间短，然后键盘的手感很好，15.6寸也算不上很重，这款电脑还是挺轻的，还咐带了数字小键盘，直接爱了！然后就外观也不错啦！挺办公的，买来做做文件，还是超赞的，而且开机也快
46,16566494384,2021-11-03 14:04:07,5,电脑收到就迫不及待的打开，开机速度10秒完成，很快。看着很精致超薄本拿起来很方便。
47,16403710044,2021-10-03 08:41:22,5,华硕笔记本很好用的，又买了台新的，运行很快，办公软件用起来很顺畅，散热没什么声音，屏幕看剧很爽
48,16634240079,2021-11-13 14:11:34,5,对比了好几款才选择的华硕，双十一到货很快，运行流畅，屏幕大，孩子平时学习娱乐足够
49,16427541825,2021-10-07 16:57:48,5,质量很好，每一步的设置都有语音提示，使我这种困难户可以从容面对。开机之后，可以升级到最新版本的操作系统11，终于体验了。赠品很好。
50,16398705044,2021-10-02 10:23:57,5,这款华硕笔记本做工精品.运行速度超快，屏幕画面细腻.散热效果不错..很薄那种.大屏幕我很喜欢。
51,16575438509,2021-11-04 18:54:39,5,电脑收到了，玩游戏，看电影，做图片都特别流畅，开机速度很快。性价比高。值得购买。
52,16372355083,2021-09-27 16:59:47,5,电脑真的很不错呀，做了很多攻略终于买了这款，质量很好，用来学习，网速也快，性价比也高，对了，客服也特别好，有问必答的，外观简约好看
53,16400163613,2021-10-02 15:09:06,5,自营的东西，物流也很快，昨晚十点多下单，今天上午就送到了。包的很细致，两层硬纸盒再加一次泡沫保护，键盘屏幕垫有保护膜，防护措施很到位。电脑很轻薄，开机速度很快，风扇声音很小，华硕的本，散热一直很出色，用了半天一点也不热。平时不怎么玩游戏，用这个本办公查资料娱乐完全够用，还送了电脑包和鼠标，挺不错的一次购物。
54,16578610170,2021-11-05 09:48:12,5,物流很快，第二天就收到了，颜色挺好看的，性能不错，轻薄型，携带方便，还送鼠标和电脑包?。开机很快，值得购买。
55,16349769329,2021-09-23 14:02:59,5,很好，比我之前第一台好多了，很清晰，很喜欢，上学够用就可以了，也很轻，系统很完美，美中不足是一开机就要我更新window有点烦。
56,16431164290,2021-10-08 10:04:07,5,笔记本收到了，屏幕边框超窄，看上去就和以前14寸的本子大小一样，重量控制的也不错，单手拿不费劲，颜值也在线，赠送的电脑包也很好看挺实用的，鼠标也很小巧好用。整体都很满意！
57,16462471650,2021-10-14 22:56:50,5,电脑开机速度快，颜色，大小非常满意，运行速度也快，值得购买！
58,16413691578,2021-10-05 11:55:37,5,"华硕vivobook15这样的配置性价比很高,电脑颜值也很高,尤其是音响效果真的很不错,听歌很带感。固态硬盘和机械硬盘的组合完美,唯一的遗憾就是没有键盘背光,总之一句，物超所值！值得购买。"
59,15457992709,2021-03-24 20:13:51,5,"其他特色：外观轻薄
运行速度：三妙开机，运行速度流畅
散热性能：用了一个小时也不卡，
屏幕效果：很清晰、比想象中更给力"
60,15362413824,2021-02-28 13:49:11,3,快递很快，第一次在网上买电器，还是很忐忑的。用着还行，就是外观可能不太好看。客户态度不是很好
61,16461292325,2021-10-14 18:05:51,5,今天刚收到货，物流很快，包装很好，机子外观大气，运行运行速度很快，屏幕清晰，华硕笔记本电脑，杆杆的
62,16446218367,2021-10-11 11:30:35,5,物流很快，第二天就到了，机子也很好，值得信赖。
63,16433785438,2021-10-08 19:45:47,5,电脑屏幕很大，非常清晰，硬盘大，客服非常优秀，物流很快，运行速度也不错，性价比挺高的一款笔记本
64,16583391454,2021-11-05 22:25:42,5,电脑非常不错，双硬盘很实用，开机都是秒开，安装软件特别快，玩游戏一点也不卡，非常棒
65,16458874801,2021-10-14 08:39:54,5,"轻薄程度：很薄，很舒服，出门携带很方便，女生也?。
外形外观：银色很高级。整体很满意。
屏幕效果：不累眼，分辨率很高。
运行速度：很不错，第一次激活有点慢，再以后开机都六七秒，运行各种办公软件也比较顺畅。
整体来说性价比很高，值得购买，特别推荐办公人群。"
66,16598447403,2021-11-08 12:02:27,5,"华硕电脑是正品，跟商店里买的是一样的，在这网购方便快捷，品质放心，还会光顾！
运行速度：非常快，速度快的很啊"
67,16420083107,2021-10-06 12:25:27,5,和预想的一样，运行很快，屏幕色彩也很好。操作简单。客服棒棒哒，还赠送了原装鼠标和电脑包。总之，比预想的好很多。
68,16549133234,2021-10-31 22:16:37,5,京东送货很快，已经第二次买这台笔记本的，品质真的不错！非常的好！质感也不错、华硕值得信懒！还送了鼠标！电脑包、很贴心哦！好评n
69,16443556097,2021-10-10 18:00:07,5,银色大气上档次，运行速度非常快，屏幕分辨率比较高，色泽清晰，大屏、超薄，尺寸适中。快递服务好，而且快。非常不错的一次购物。
70,16459825172,2021-10-14 12:33:25,5,第一次用华硕的，希望用起来没烦恼吧！包装结实，京东第二天就到了，神速京东自营，机子大小老公用正合适，本以为会很大，结果大小刚好，价格也还好?，指导安装后可以用起来啦。
71,16299014325,2021-09-13 21:43:13,5,"很好看很轻便，开机速度老快了，适合办公银色的颜色很好看
运行速度：快
屏幕效果：色调很好
外形外观：好看"
72,16359647487,2021-09-25 14:41:29,5,"送货好快呀！下午6点买的早上就到货了。惊喜呀！喜欢的朋友购买呀！
运行速度：不到5秒
屏幕效果：漂亮
散热性能：可以
外形外观：漂亮
轻薄程度：薄"
73,16577294577,2021-11-04 22:45:00,5,非常漂亮，原装正品，很精致，速度也快，性价比很高，晚上抢购的，很满意，爱了爱了。
74,16437716998,2021-10-09 15:51:25,5,"运行速度：很块啊，很不错，值得拥有
屏幕效果：很清晰细腻
散热性能：一点点，问题不大
外形外观：简约线条流畅
轻薄程度：刚刚好，太厚不好看
其他特色：运行速度很快，反应快，不错不错"
75,16582246635,2021-11-05 19:27:27,5,开机速度杠杠的，屏幕大，分辨率高，关注很久了，特别喜欢，也推荐给了朋友?●&acute?`●?
76,15397823119,2021-03-08 22:58:53,5,昨天下单今天就到了。物流很快。快递员也是及时联系。拿到机，就迫不及待的想体验了。对于我这种电脑小白，客服很耐心热情的指导我如何使用。本本还是蛮好看的外观。刚开始用，还不错呢！下了几个软件。先体验一看视频的感觉。还可以，速度蛮快的。是一次不错的购物感觉。?
77,16550861204,2021-11-01 09:55:22,5,电脑主要买来有时方便回家工作，用了一段时间，感觉挺满意。银色本想着将就，看到实物很喜欢。不错！！！
78,16613579037,2021-11-10 18:52:12,5,开机速度很快，用下来很流畅。屏幕也比较大，很适合看视频，办公。送的包和鼠标也很好。银色版真的很合心意了！
79,16591069332,2021-11-07 10:54:39,5,华硕品质，值得信赖，无论是做工和性能都非常好，我平时就打个文件，cad看看图，足够用了，反应很迅速，颜值没得说，太喜欢了
80,16406886777,2021-10-03 22:10:35,5,"外形外观：非常喜欢，银色，很好看
轻薄程度：可以
屏幕效果：不错
其他特色：手感很好"
81,16633750485,2021-11-13 12:53:27,5,华硕这款电脑是我对比了几家同价位性价比最高的一个了所以乘着双十一果断下单了 电脑开机速度很快开机后按流程操作对于新手小白的我来说很友好哦犹豫的姐妹们可以果断下单哦外观设计也好好喜欢 目前使用感觉很不错送的包包和鼠标感觉很不错
82,16638133268,2021-11-13 23:17:16,5,"开机一瞬间，我只能说，我刚刚把手机开了录像，他它就已经好了！
运行速度：超快，
轻薄程度：非常轻薄。"
83,16568166257,2021-11-03 18:32:08,5,颜值很高好 轻薄带着不累  开机速度超快  玩游戏也毫无压力
84,15408393459,2021-03-11 15:41:09,5,"外观：银色的，外观很漂亮，看着很有质感，本以为15.6会很大，收到后感觉还很小巧，很轻薄，重量也ok
操作：配备系统，开机根据提示安装即可，很方便。安装后开机速度特别快，系统运行很好
散热和声音：系统散热很好，在使用中，有时候风扇声有点大，不过可以接受，总体还是非常满意的。平时也没太高要求"
85,15407738917,2021-03-11 12:52:43,5,"开机速度很快，用的很流畅，系统稳定，
物流很快，态度也很好，很是喜欢。"
86,15404516715,2021-03-10 16:07:26,5,电脑收到了，非常开心，真的是很轻薄，外观非常漂亮，键盘和电源键美妙组合在一起，看起来非常的整洁、美观，开心极了
87,16451097376,2021-10-12 14:33:35,5,"配送齐全，赠品到位。
电脑参数符合实际。
开机很快，颜值很高。
屏幕很舒服，没有坏点。
总的来说，性价比这块无敌！"
88,16476240308,2021-10-17 19:00:32,5,运行速度快，屏幕清楚，散热不错，外形美观，物流很快，性价比确实高，用后再来追评
89,15401942878,2021-03-09 22:37:39,5,电脑屏幕够大，够轻薄，带着方便快捷，外观好看&hellip&hellip用着感觉很好，够快，对比过很多款，感觉这款性价比很高。
90,16421297705,2021-10-06 15:26:33,5,外观设计漂亮，尺寸大小合适，包装仔细完整，宝贝手感不错，开机速度快，反应快，运行流畅，几乎没有噪音，散热很好，总之感觉超好，发货速度快，服务态度一流，给力！
91,16597258593,2021-11-08 08:34:53,5,性能和配置都是不错的，选择华硕笔记本电脑?就是最好的选择。在直播间下单的还是很合算的送了3?3还可以领券
92,15870595327,2021-06-25 23:25:51,5,用了几天了，系统运行的挺流畅的，屏幕看起来也很清晰，买来办公用的，偶尔还可以打打小游戏，挺好
93,16410456184,2021-10-04 20:09:09,5,物流没得说，完美，电脑颜色太好看了，质感超好，运行速度快，爱了爱了，我家姐姐看了也想要买这款，值得推荐！
94,16624791138,2021-11-12 08:10:51,5,物流很快，?产品很快就收到了，比想象中还好，不错不错！给弟弟买的用来上课的，学习PS之类的，本本很好看，还送了包包和鼠标，希望能耐用。
95,15854470625,2021-06-22 22:55:18,5,"送货速度没的说，然后电脑超级满意呀～
1.开机挺快
2.运行挺快，用起来很舒服
3.颜值?
4.客服服务态度超级好呀，很耐心
5.电脑屏幕挺大的
大家快来买吧～～"
96,16517298631,2021-10-25 19:01:58,5,笔记本很不错，做工还是质量都很棒，华硕的品牌不用担心！画质比较的清晰！也比较的薄，性价比非常的不错！办公娱乐基本都 够用！比较推荐大家入手！真心的性价比超高！
97,16429698042,2021-10-07 23:05:10,5,高级感一下就上来了，配置非常很奈斯?对于大学生来说是一个非常不错的选择，性价比非常高，电脑也很顺畅?
98,16479002355,2021-10-18 10:10:30,5,国庆节活动买的这个笔记本，给外甥买的！非常不错！独显处理器都非常好，用了一段时间很流畅！外甥很喜欢！
99,16426913757,2021-10-07 15:21:46,5,"电脑收到了，还送了鼠标和电脑版。很漂亮。
运行速度：不错。很轻薄"
100,16408272352,2021-10-04 12:04:00,5,非常满意的一次购买！客服服务态度非常好！电脑质量也好！开机就用了几秒钟！这价位性价比简直无敌了！头一次买轻薄本儿，非常满意！！
101,16440555752,2021-10-10 07:26:41,5,一拿到手，就打开看看，颜值很高，开机速度很快，屏幕也很清晰没亮点，华硕品质一如既往的好！
102,16531260972,2021-10-28 13:49:18,5,运行很快，内存也满意，外观精美，这款上网学习最适合，非常满意，点赞
103,15516645886,2021-04-09 16:35:26,5,颜值高，薄，运行速度飞快，几秒就开机了，超级流畅，分辨率可以。办公用一流。全轻了，朋友看到我买了这款。。看到很喜欢。居然跟着买了。也是这家店。不错不错。很满意。客服响应回复得很快。很喜欢
104,16595479150,2021-11-07 21:14:42,5,华硕（ASUS）VivoBook15笔记本外观非常好看，手感很好，激活也很容易，反应速度很快，外观非常漂亮，简洁，一种高端大气的感觉。全金属机身，超薄，握感非常舒适，屏幕高清，运行很快，性价比高，电脑用了一段时间了，没出现什么问题。
105,15288767005,2021-02-03 21:48:47,5,电脑屏幕很大，很清晰，浏览器加载速度快，内存大，噪音小，硬盘容量大，比家里的旧电脑快太多，好太多。售后服务态度好，物流速度非常快！
106,16422788103,2021-10-06 19:16:00,5,电脑非常好看，颜色很喜欢，看着很高端大气，也很有质感，用起来反应很快
107,16576728224,2021-11-04 21:31:06,5,新到的电脑使用了几天，感觉还不错，流畅度也很好，主要我也就是用来写写文，做个PPT，还是不错的，客服也很好的，很耐心的教我一步一步操作，就是开机后有些许麻烦，要很注意。
