,ID,发表时间,满意度,评论
189,13720744520,2020-01-14 09:19:49,5,"运行速度：非常快，指纹解锁。
轻薄程度：超级薄。
散热性能：学习了一下午课程，笔记本散热非常好。
屏幕效果：大，超宽。
外形外观：非常时尚，是不是太薄了呵呵。"
190,13283824386,2019-10-01 18:48:26,5,"运行速度：快
屏幕效果：比起我的老dell非常棒
外形外观：金属感强，媳妇儿子都很喜欢
轻薄程度：轻薄
其他特色：深度也还可以用
散热性能：不烫"
191,13414367039,2019-11-05 18:52:57,5,"运行速度：快速没问题
屏幕效果：很好，次用过的高分还舒服
散热性能：待检验
外形外观：没毛病
轻薄程度：很不错，这个厚度和有些13的商务本差不多了
其他特色：价格好性能可以"
192,16607494953,2021-11-09 18:47:09,5,本子很快就拿到了。激活后感觉速度很快。用了几天才来评价，货真价实，还是很不错的
193,13340774587,2019-10-18 06:50:07,5,"运行速度：反应特别快
屏幕效果：屏幕真的爱了！16英寸比A4纸还大，真的特别舒服！
散热性能：散热好，温度上不去
轻薄程度：虽然屏幕大，但是真的一！点！也！不！重！
其他特色：指纹解锁真的吹爆！
外形外观：做工细腻让人想摸哈哈哈哈"
194,16263778770,2021-09-07 10:46:02,5,电脑收到了，颜值很高，用起来也很流畅。也送了不少赠品，卖家服务也很好。
195,15903809441,2021-07-01 15:57:13,5,"618购买的，非常划算，机子外形很好看,是正品！开机很快,屏幕素质也很棒,超高屏占比,雾面屏也不会反光!当时选中它也是因为这块屏幕!刚开始用时用了卡硬工具箱做了简单测试,没有问题。别看16.1寸的屏幕,重量更轻,实在满足了我对于大屏轻薄本的需要。
但是也有不足：一边充电一边用的话，摩擦外壳有电流的感觉，可能是因为金属壳
目前就这些，用一段时间后再追评"
196,13315673744,2019-10-11 12:58:36,5,卖家服务态度很好！热情，积极帮助顾客解决问题！东西质量很好！电脑颜值十分高，发货速度快，包装完好，目前还在熟悉这个Linux系统，上手挺快的这个系统，操作流畅，超爱这个电脑。
197,16655581825,2021-11-15 23:36:54,5,"运行速度：开机很快，测试分数100万
外形外观：外观漂亮，非常喜欢
轻薄程度：很薄，很轻，方便"
198,14939166750,2020-11-21 01:57:36,5,"运行速度：挺快的，足够用
屏幕效果：色彩很好，清晰
散热性能：散热性很好，不发烫
外形外观：外观大方，有面子
轻薄程度：轻薄颜值高，很轻，很薄。喜欢
其他特色：16.1寸深得我的喜爱，客服也很耐心帮我解决问题"
199,13409014543,2019-11-04 18:08:31,5,这款电脑16.1寸的屏幕大而绚丽，锐龙5的处理器一点都不比酷睿5的差，开机速度很快，只有几秒，而且可以指纹解锁。DeepinLinux的系统集成度很高，本想用用的。但是要做文字工作，还是换成了Win10。总之，物超所值，荣耀MagicBook is great!
